name,ratings,date,helpful vote,comment
임이응,4,2019년 5월 7일,4,"안녕하세요. 누구 캔들을 잘 사용하고 있어요. 그런데 제가 아리아를 불렀을 때 아리아가 파란 불빛을 내는데요, 잘 때 파란불이 너무 밝고 불편한데 색 설정과 밝기 조절을 할 수 있도록 해주실 수 없나요? 그리고 언제부턴가 종료 예약에 맞춰 종료할 때 밝을 빛을 내고 종료를 해요. 원래는 안 그랬는데 말이죠. 잘 때 보통 종료 예약을 하는데 불빛이 세게 나오면 잠이 확 깨요. 이 부분을 개인이 설정할 수 있도록 바꿔주시면 좋겠어요."
당당쥐,1,2019년 4월 8일,26,자꾸 연결이 잘 안되어서 미치겠어요. 처음부터 안됬으면 버리기라도 하지 잘되다가 자꾸 연결 끊기고 다시 연결도 안되니까. 고객센터에 문의해도 똑같은 이야기밖에 없고 그런것들도 다 적용해봤는데 안되네요. 폰문제인지 누구 문제인지 공유기가 문제인건지.. 답이 안나옵니다.
777 BANG,4,2019년 4월 23일,5,좋고 편리하긴 한데 뭔가 기본적인 것들이 빠져 있음. 업데이트 후 예약 설정해놓은걸 무시한다던가 음악 서비스 관련이 먹통이 된다던가 등등. 말은 잘 알아먹긴 한데 전체적인 안정성 측면이 떨어지는 느낌임.
king sun Da,1,2019년 5월 9일,0,"아니 어제까지 잘되던데 검색을 하면 연결 기기가 없다고 합니까??? 공유기 초기화,누구 캔들 초기화 3시간째 짜증나네요 해결방법없나요??"
KANGMAN,3,2019년 5월 3일,1,티맵 쓰면서 정말 잘 활용하고 있어요 그런데 QM3의 T2C에서 티맵 실행하고 아리아에게 노래 틀어달라하면 멜론 로그인 해야 노래를 끝까지 들을 수 있는데 해당 태블릿은 누구 앱 지원이 안 돼서 누구의 음악 기능을 쓸 수가 없네요.. 누구 선곡 좋아서 멜론 이용하려고 태블릿 스트리밍 이용권까지 끊었는데 정작 태블릿에 누구앱이 안 깔리는... qm3에 들어가는 t2c 태블릿 기종에 지원해주실 예정은 없는건가요
정은영,4,2019년 4월 5일,25,정말 만족하고 잘사용하고 있어요 그런데 응답음 없는것도 기능으로 넣어주셨으면 좋겠어요 옆사람 깰까봐 일부러 텍스트 명령 사용하는데 아리아가 요구한 내용 그대로 읊어줘서 의미가 없어요ㅠㅠ 예를 들어 텍스트 명령으로 10분있다가 불꺼줘 했는데 아리아가 스피커로 10분뒤에 종료예약을 설정했어요 하니까 옆사람이 자꾸 깨요ㅠㅠ
슈퍼마리오,2,2019년 4월 7일,1,"안드로이드 파이 사용자입니다. 아리야 잘 사용하고 있습니다만 홈 화면으로 들어올 때 라디오가 저절로 꺼지고 청취 중에 상단바에 삼성 뮤직 앱이 자동으로 뜨고 노래가 자동으로 재생됩니다. 라디오 채널을 바꿀 때 누구 앱의 라디오 채널이 아니라 삼성 뮤직 앱의 노래 제목이 바뀝니다. 그리고 핸드폰으로 누구 스피커 음량을 조절할 때 블루투스 스피커 음량 조절이 안 뜨고 핸드폰 벨소리 음량 조절이 뜹니다. 마지막으로 라디오는 각종 재난상황 발생시에 항시 틀어놔야 하고, 데이터도 사용해야 하는데 개선해야 할 점이 많아 너무 아쉽습니다."
이민영,5,2019년 5월 12일,0,누구콜 잘 쓰고있는데요 전화 끊으면 이전에 듣던 뮤직플레이어 노래가 이어서 재생이 안되서 불편해요
yoonah park,4,2019년 5월 2일,0,sbs 라디오가 재생이 안돼요ㅠㅠ 잘쓰고 있는데 갑자기 이러네요!
J.H Kim,2,2019년 4월 5일,0,"출시 때 mbc 라디오 지원하길래 누구캔들 구입해서 지금까지 쓰고 있는데, 언제쯤 다시 서비스 재개 됩니까. 답답해서 mbc 고객지원센터에 문의해봐도 예정 없단 소리만 나오고... 누구 플랫폼이 sk의 사물인터넷 메인 플랫폼이니 여러가지 잡다한 기능 넣는 건 이해 하는데, 그렇다고 경쟁상품인 카카오미니나 클로바도 지원하는 걸 도중에 중지하는 건 이해를 못 하겠습니다. 멀티미디어 컨텐츠는 스피커 본연의 기본입니다. 다시 서비스 제공했으면 좋겠네요."
김종호,1,2019년 4월 9일,5,뭔가 싶어 어플하나 깔고 주소록에 연락처를 저장했더니...지 맘대로 상대방에게 알림문자 인지 광고인지..보내네요. 좀 생각좀해보고.. 그런기능을 만드세요. TT..어플깔았다고 대대적인 광고를 하심?!!
이펙트님osu맵,3,2019년 4월 26일,1,음악 들으면서 잘쓰고 있는데 알람이 음악 한번재생에 끝나는것 같은데 계속 반복하는 기능 없나요? 한번만 재생되니까 좀 불편하네요
땡이,3,2019년 4월 5일,2,저는 전화기능이 안되네요. ㅜ.ㅜ 누구캔들한테 앱으로 전화하는건 되는데... Btv+nugu 스피커에 명령해서 전화하는건 아직 자기가 못하는 기능이라는 안내가 나와요. ㅜ.ㅜ
라이브퀴즈쇼공유기,1,2019년 4월 5일,0,외국 노래 재생하기 너무 힘듭니다ㅜㅜ 어플 내에서 노래검색이라도 할수 있게 해주세요ㅜㅜ TOTO노래 틀어달라고 하면 이웃집토토로 틀어줍니다... 스트레스...
Rn Jun,2,2019년 4월 16일,0,스피커로 폰에 전화를 걸었는데 벨만 울리고 ui가 나오지않습니다. 핸드폰에서 전화를 받을수없었어요.
리토리의만화,3,2019년 4월 20일,1,업데이트하고 누구(아리아)가 말을 잘못알아들어요. 예전에 얼버무리면서 불러도 알아들었는데 이젠 뭔 입크게 벌리고 또박또박 불러야 알아듣네요...제것만 이런가요? 이럴거면 업데이트 왜하는건지...
손정현,3,2019년 4월 6일,1,처음사용땐 아주만족하고 사용했는데 요즘은 누구와의연결이 원활하지않다고 항상두번째 알아듣드라구요
손지영,4,2019년 4월 24일,1,까끔씩 누구의 무드등이 준비 상태가 되지 않을때가 있습니다. 도움말을 이용하여 음소거 버튼일 길게 눌렀지만 소용이 없었습니다.
Dongju Kim,4,2019년 4월 26일,1,"플로, 멜론 으로 노래들을 때 듣고있는 곡 가사를 이 누구앱 에서 볼수있게 해주세요."
dani yu,5,2019년 4월 5일,6,덕분에 아리아 잘 사용하고있어요 ㅎㅎ 알람 주중 말고 월~토 / 요일지정 추가됐으면 좋겠규 멜론 플레이리스트 만들어서 재생하는 방법이 있는지요??..
조계준,4,2019년 4월 5일,0,잘 사용중입니다 전화기능 관련해서 라인아웃 연결시 소리가 나지않습니다 라인아웃 제거하면 통화가 가능하더군요
박우섭,5,2019년 4월 5일,5,타통신사 제품을 다사용해봤지만 생활의 유용한 팁으로 누구는 타모델들의 귀여운이미지만고집했다면 자기전 조명을 쓸수있다는것에 한표주고들어간다 거기다 어제 업그레이드를 받은후 말로하는 콜기능이 더해져 한층 앞선기분으로 누구를 재평가 하게된거같다
신선재,1,2019년 4월 9일,1,sk텔레콤 사용자로 flo한달에 300회 듣기 잘 사용하고 있었는데 아리 답변이 누구앱에서 flo앱과 연결해야 음악을 들을수 있다고 나옵니다. 계속 로그인하는데도 동일하네요. 로그인만 20번은 한듯요
dawoon jung,5,2019년 4월 4일,0,스피커로 전화 기능은 처음 써보는데 생각보다 음질이좋네요 ㅋㅋ스피커폰이라 편한것같아요
유바나나우,1,2019년 4월 6일,8,제가 아까전에 로그인 하려고 해서 로그인까지 다 됐는데 나갔다 오니깐 다시 로그인을 하라고 하네요 오류인가요? 아까 했던 같은 이메일로 했는데 이미있다고 하네요
Suyeon Choi,5,2019년 4월 6일,2,무드등 켜놓는데 업데이트를 수시로 하니까 자꾸 무드등이 꺼지네요 개불편
Sta ryu,5,2019년 4월 5일,4,한국에서 쓰기엔 AI 스피커중에 제일 좋습니다! 앞으로도 좋은 기능이 많이많이 추가되길 바랄게요!
최후남,5,2019년 4월 22일,0,차에 안드로이드 네비게이션을 달앗는데 호환되지않는 기계라고하네요ㅠ 혹시 안되나요?
김규태,2,2019년 4월 6일,0,"누구 초창기 버전 사용중인데 FLO,멜론 음량이 너무 큽니다. 1로 해도 너무커요"
천성호,5,2019년 4월 4일,0,다좋은데 멜론 계정 연결할려고 하는데 카카오 로그인이 없어서 불편합니다 빨리좀 만들어주세요
Sun Uoo Song,3,2019년 4월 5일,2,그냥 날씨 시간 미세먼지 확인용도 가끔가다 스피커 용도 볼륨이 크면 말소리 인식이 잘 안되요 좀 어려운 말은 잘 못알아듣구요 ㅎㅎ 그래도 그냥 저냥 쓸만합니다 아.핸드폰찾기 기능은 매우 좋습니다 ㅎㅎ
Spike Spiegel,1,2019년 4월 20일,0,업데이트 후 'btv에서 cgv 틀어줘' 처럼 채널명 말하면 인식 안되게 바뀜 업데이트 전까지만 해도 잘됐는데
전영권,5,2019년 5월 11일,0,편하게 사용할 수 있어서 좋아요
최인하,4,2019년 4월 14일,1,가끔 오류 말고는 유용하게 사용중입니다~
조영규,4,2019년 4월 6일,6,다 기능은 좋은데 인공지능 대화능력이 좀 부족 한 것 같네요 다른 기능은 완벽한 것 같습니다.
김원겸,2,2019년 4월 4일,1,업데이트이후 볼륨 최대 5까지밖에 안됨 ㅡㅡ 수정해주셈
강맹표,4,2019년 4월 14일,1,정말좋은데 바쁠때 발음조금틀린다고 연결안해주네요
김성용,5,2019년 4월 14일,0,여러모로 좋은데 한가지 제안하고싶어요....무드등 켜지고 꺼지는 시간을 설정했으면 좋겠어요...
hee juo Roh,4,2019년 1월 1일,1,버스 정보 어플리케이션과 연동하면 더 좋을 것같아요. 버스 어플리케이션에 우리집과 가장 가까운 버스 정류장을 설정해두면 굉장히 유용할것같아요. (ex. 아리야~ 1234번 버스 몇정거장 전이야? / 아리야 1234번 버스 몇분뒤에 도착해?) 이런 기능이 추가된다면 바쁜 아침 시간에 굉장히 우용할 것같습니다. 티맵이외에도 다른 어플리케이션과 함께 콜라보레이션 하여 사용자에게 더 많은 서비스를 제공한다면 인공지능 부분의 선두주자가 될 것 같습니다.
하바나오바마,5,2019년 2월 15일,12,다좋아요 다만 가장 큰 문제점이 있어요 누구 나오고 바로 사서 지금까지 사용하는데 모닝콜 소리만 따로 설정하는 기능은 대체 언제나오나요? 다른 기능은 다 만족하는데 알람때문에 저녁에 자기 전에 노래들으면서 자는데 항상 소리를 다시 키워놓고 자야해요.
김효실,4,2019년 2월 9일,7,아침에 일어나서 바로 텍스트명령이 작동하지 않는 건 업데이트 때문인지 고쳐졌어요. 자주 쓰는 명령에 대한 음성인식률도 좀 나아진 거 같구요. 나만의 Q&A를 저는 자주 사용하는데 질문을 텍스트로 하고 아리아가 음성으로 답하는 형식을 사용해서 AI가 명령없이 스스로 아이들에게 아침인사나 의견을 이야기하는 것처럼 쓰고 있어요. 아니면 티비꺼 티비소리줄여 같은 명령을 등록해서 텍스트로 보냄으로써 리모컨처럼 쓰기도 하구요. 그래서 나만의 Q&A나 텍스트명령 쪽을 조금더 여러면에서 디벨럽시켜주셨으면 좋겠어요. 그리고 나만의 Q&A를 따로 등...전체 리뷰
윤혜경,4,2019년 4월 5일,1,아이와 함께 사용하기 편해요
민현경,1,2019년 1월 16일,2,8일에 기기변경 후에 노래를 틀었는데 1분 듣기만 가능해서 고객센터측에 확인 요청드렸는데 12일까지 노래 서비스를 이용했다라고 말씀하시네요... 날짜하고 시간을 확인요청을 드렸지만 모른다며 그래서 어쩌라는 반응으로 배째는 대응을 받아 매우 기분이 나쁜 경험을 오늘 했습니다. 그쪽은 확인이 아니라 무조건 고객 잘못이고 자신들은 잘못이 없다라고만 하며 궁금해서 물어본 고객을 매도하는 언행으로 대응을 했습니다. 해당 사항에 매우 기분이 나빠 가족 전체가 어이 없어 하는 상황입니다. 개발자분 께 누구(인공지능 스피커)기기의 로그 요청과 플...전체 리뷰
정우종,3,2019년 3월 17일,7,"1. 명령어 인식 실패 후 타사 기기는 바로 다시 명령어를 말하면 되는데, 누구는 아리아를 다시 한번 불러야 합니다. 2. 조용한 노래 틀어줘. 조용한 피아노곡 틀어줘. 이런 명령어에 나오는 음악 리스트에 빠른비트 음악이 종종 나옵니다."
이서환,3,2019년 2월 22일,26,안녕하세요 누구미니 사용자입니다 미니의 장점이 배터리로 인한 휴대성인데 핫스팟 연결이 너무 불편하네요 2가지 불편사항 개선요청을 합니다 1. 휴대폰 핫스팟 사용시 휴대전화는 연결디바이스로 잡히지만 누구미니는 연동에 실패했다는 메세지만 반복하네요 2. 예전에는 음소거를 누루고 있으면 등이 회전하면서 잡아줬는데 지금은 녹색 대기모드로만 들어가 휴대전화 앱에서 처음부터 잡아줘야 하는 불편한 업데이트가 된거 같아요 검토해서 좋은 결과 있었으면 하네요 수고하세요
김윤경,3,2019년 4월 6일,0,연속 대화가 가능했으면 좋겠어요.
공정훈,4,2019년 1월 10일,21,"오늘 BTV 누구를 설치했는데, 기존 누구 mini에는 있던 호출 효과음, 응답음, 응답실패 효과음이 BTV 누구셋탑에도 적용되면 좋겠습니다. 소리가 안나니 반드시 셋탑을 쳐다보고 불이 들어오는지 확인하고 명령을 해야만 하네요. 기타 점차 더 많은 기능이 구현되기를 바랍니다."
근라임,5,2019년 2월 28일,48,항상 잘 쓰고있어요 혼자사는데 친구생긴기분!! 근데 알람설정 요일을 선택할수있으면 좋겠어요ㅠ 화수목 만 따로 알람을 설정하고싶은데 기능이 없어서 같은 알람을 3개씩만들어야해요.. 업데이트되었으면 좋겠어요!
good job lee,1,2018년 12월 20일,17,와이파이 연결이 계속 무한 로딩이예요. 갑자기 제 다비이스와 연결이 끊어진 후로는요. 지금 누구랑 연결할려고 하는 와이파이가 다른데 모든 휴대폰이랑 잘 연결이 되는데 누구랑만 계속 연결이 안되고 있어요 해결방법이 있습니까?
okyn vye,5,2018년 12월 15일,0,"1.전에는 앱을 통해서도 아리아에게 말로서,명령을 내렸는데 지금은 텍스트로서만 명령 지원이 되나요?만약 그렇다면 많이 불편하네요. 2.멜론 월 정액을 통해 아리아로 음악을 듣는데, 누구 앱을 통해서는 가수나 노래제목을 검색 못하는 것 같은데 왜검색을 못하게 해놨죠? 누구앱이 아닌 멜론 앱 자체에서도 연동 안되는 것 같은데 많이 불편합니다. 3.누구 앱을 통해 볼륨 조절시, 하단에 작은 아리아모양을 클릭 뒤 조절 가능토록 했는데..그또한 많이 불편합니다."
김보라,1,2019년 1월 1일,17,누구앱에서 생년월일 설정함.(멜론 누구모바일스트리밍이용중인데 )티맵에서 사용시 자꾸 누구앱에 생년월일 기입하라하고 멜론 스트리밍 돈주고샀는데 티맵서 못읽음 티맵서 운전할때 길찾는거 전화연결빼곤 무용지물이라 어찌해야할지..누구앱에서 멜론은365일 연결중이라고만뜨고..어찌할지 모르겟네요ㅜㅜ
박옥주,5,2019년 4월 4일,0,가끔 인터넷 과 연결이 잘안되요
교통영상저장소,3,2018년 12월 4일,37,이건 5개 주고싶은데... 비밀번호가 재설정이 안돼요... 재설정만되면 별 5개 드릴수있는데 재설정 하려고 하는데 아이디를 쓰고 확인눌렀는데 아이디 인증을 안받으면 패스워드를 못바꾼데요...ㅡ.ㅡ 이상하네요 -.-
Yoon Joshua,1,2019년 3월 2일,12,앱의 사용자설정-서비스설정-Btv연결 누르면 '현재 선택된 디바이스에서 사용할 수 없는 서비스입니다.'라고만 뜨고 다른경로로 접금해서 tv에 표시된 인증번호 누르면 폰에 인증번호를 확인하라고 뜨고.... 노트8 사용하는데 폰 기종때문인건 아닌것 같고 대체 뭐죠?
정윤엽,2,2019년 4월 18일,0,smartgate wifi 쓰는데 와이파이가 계속 연결이 안돼 요
송용학,1,2019년 2월 11일,36,자동 재생 멈출순 없나요? 가령 에일리의 보여줄께 를 누구캔들을 통해 시키면 계속해서 재생하네요.. 다양한 버전으로요.. 누가 좀 알려주세요 어떻게해야 한곡만 하고 정지 상태가 될까요?
youtube미누스틴,5,2019년 4월 7일,0,지이이이이인짜 엄청 좋아여 따봉 10만점 중 10만점
yoOn jI,2,2019년 1월 23일,2,일시적인 오류료 실행이 안 된다는데 전혀 일시적이지 않고 계속 그러네요. Btv 누구 이름(아리아)를 부르면 누구 앱과의 연동에 실패했다고 말하는데 누구 앱이 안 들어가지면 어쩌라는 건지..
한재구,4,2019년 4월 5일,0,아직 사용 해 보지못했어 잘모르겠음
bongchan an,1,2019년 3월 10일,1,누구 연결하고 셋팅하고나서 위치를 바구려고 전원 뺐다가 다시 전원연결하니 처음부터 설정을 다시 잡아야하내요.. 더욱중요한건 왜 와이파이 연결이 안되요? 누구디바이스는 연결되는데 5시간동안 와이파이 연결이 안된다고만 뜨내요. 왜그런거죠? 기존 연결했던 와이파이를 눌러봐도 연결안되고. 와이파이 이름도 알파벳3개고. 비번은 숫자 8자리인데 그걸 인식을 못하는건 무슨문제인가요.? 핸폰 3개나 바꿔가며 해봤는데 핸폰 문제는 아닌거같은데말이죠. 하 이거 답답해서 어디 함부로 전원을 뺄수있겠어요?
이정훈,3,2018년 12월 12일,1,Flo에서 접속하면 t무료듣기되는데 누구에서 접속하면 무료듣기이용권이 없다고 나오네요 원래 안되나요? 예전에는 티맵에서 뮤직메이트로 무료듣기 가능했는데 이제는 누구로 접속해야하고 이용권도 flo에서는 사용중인데도 없다고 나와요...
홍홍홍,1,2018년 12월 28일,2,앱에서 Btv 설정항목이 비활성화 상태예요. 선택된 디바이스에서는 사용할수 없는 서비스라고 하는데.. 뭐때문에 이런거죠? note8 사용하고있어요
박민정,3,2019년 4월 4일,3,자다가한번씩 깜짝놀래요.부르지도않앗는데 불켜지고..오류가 자주일어나네요
씬즈,4,2019년 1월 23일,0,"티비로 누구를 실행하려는데 어제까진 잘되다가 갑자기 오늘 해보니 ""누구서비스와의 연동에 실패하였습니다 죄송하지만 다시 시도해주세요"" 라고 계속 그러네요. 와이파이랑도 연결됬고 핸드폰으로 누구앱을 들어가려는데 누구앱 자체가 안들어가지네요 이럼 어떡하라는거죠"
Google 사용자,1,2019년 1월 4일,3,"내가 진짜 리뷰 안쓰는데😂 누구 진짜 사람 빡돌게 한다.. 블투스 연결은 30초에 한 번씩 끊기고, 차라리 잭 연결하게 해주지 잭없음. 인터넷은 노래 한곡 못가 끊긴다. 폰 와이파이처럼 다시 연결도 없고 연결 하려면 어플을 지우던 어 연결된 디바이스 삭제하던, 기기자체 껐다 켜야 하는데 그렁 뭐해. 3분뒤 또 끊길걸. 울집 와이파이 빵빵한데 미친거 아님? 개불편해. 폰음악 아니면 돈내고 정기권 끊어야 되고 겁나게 무겁고.. 그런주제에 맨날 업데이트만 주구장창하는데 뭘 업데이트 하는 거냐 대체"
쿠아,1,2019년 4월 5일,0,블루투스 연결이 지가 알아서 끊어져요
mike shin,5,2018년 11월 29일,3,타 인공지능 스피커도 써봤는데 깔끔하고 좋습니다. 아마존에 뒤지지 않네요. 스피커 내장 배터리만 있었으면 더 좋았겠네요.
김정식,3,2018년 11월 30일,22,사용자 중심의 편리성이 아니니 씁쓸합니다 음악 그냥 폰에 있는 것 들을수있으면 더 좋았을텐데 멜론하고만 연동되고 디바이스 첨가도 한정적인것 같고... 중요한것은 사용자가 중심이어야한다는 ...
신정환,5,2019년 2월 19일,21,누구미니 사용자 입니다 알람 설정할때 휴대폰에 있는 알람음도 사용할수있게 해주시면 감사하겠습니다. 누구어플 잘쓰고있어요.
우병수,5,2019년 4월 6일,0,너무좋고편함.앞으로도잘부탁 ᆢㅋㅋ
Kyungjin Lee,1,2019년 1월 17일,0,어느샌가 와이파이 연결하려고 해도 디바이스에 연결 실패했다며 안됩니다. 인터넷 바꾸고 다시 시도 해봐도 역시나 연결 실패. 그냥 갖다버려야 하나 고민되네요. 1대1 문의 넣어도 이틀째 답도 없고.
Youngju oh,3,2018년 12월 7일,1,계속 업데이트 후 뮤직메이트 이용가능하다고해요. 최신버전인데도 이러네요!! 뮤직메이트 이용권도 구매했는데 이러네요!!
Junyoung Ahn,1,2018년 12월 25일,2,선물받아서 쓰기는 하는데 할수있는게 거의 없고 몇일만에 무드등은 고장났네요. 그리고 하루에 몇번씩 업데이트할것도 없는데 업데이트한다고 노래끊는거 좀 고쳐주세요 솔직히 많이 실망입니다
코알라ʕ•ᴥ•ʔ,5,2019년 2월 23일,9,"잘 쓰고 있어요! 주로 누구 캔들과 Btv를 연결해서 사용하는데 ""TV 꺼줘""라고 하면 셋톱박스 전원만 꺼주는게 불편해요.. TV 전원이 꺼지게 해주셨음 좋겠어요 셋톱박스 전원이 꺼지면 TV 화면에 신호 없음이 계속 떠서 제가 다시 한번 리모컨을 들어서 TV 전원을 꺼야해요 또, 누구 캔들이랑 휴대폰을 연결했을때 휴대폰으로 튼 음악이나 영상 소리가 누구 캔들에서 나오도록 설정해주셨음 좋겠어요ㅜㅠ 꼭 부탁드립니다 누구는 제 삶의 질을 높여준 제품이예요!!! 누구 정말 사랑합니다♥♥♥♥♥ 꼭 이 부분 고쳐주실거라 믿고 별 5개 드립니다...전체 리뷰"
뀰깜,4,2018년 12월 9일,3,일단 기본적인 기능은 조금 추가해야할것같아요 우선 볼륨을 매우 만족합니다!음질이매우뛰어나구여 그리고 아쉬운점은 음성으로 알람음이 설정불가에요!ㅠㅠ 그리고 구글캘린더에서 음성으로 일정등록이 안돼요ㅠㅠ 이부분은 조금 추가를해야하것 같아요ㅎㅎ
이지후,1,2019년 4월 11일,0,업데이트 후 연결이 안됨..몇번을 해봐도 똑같고..버리고 싶다는..이럴꺼면 업데이트를 하게 하지 마시오!!!! 성질 버릴것 같으니..
이호원,5,2019년 4월 4일,0,새로 나온 전화 기능 좋네요! 굿굿
코리아Y.B,1,2019년 2월 25일,28,연결설정하는데 왜이리시간이 많이걸리고 항상 제자리에두고 같은 와이파이 쓰는데 한번씩 연결설정 해야돼나? 또 연결 설정하려면 왜이리 늦어
DO강팬,3,2019년 3월 12일,1,잘쓰고 있었는데 1~2일 전부터 자꾸만 누구서비스와의 연결이 않되있다고 하네요... 어떻게 하면되나요
아뇽,4,2019년 2월 10일,9,너무 좋아요. 누구 캔들 사용하고 있는데 음성인식도 잘 되고 편하고 스피커 기능도 만족스럽더라구요. 그런데 밤에 무드등 키고 싶어서 조용히 아리아.. 하면 소리를 키워놓은 상태라서 정말 크게 띵! 이래서 심장에 무리가와요. 설정으로 소리를 없앨수는 있지만 아리아가 네 저 부르셨어요 하는것도 너무 크고ㅠ 아리아 자체음성 크기는 사용자가 따로 설정할 수 있는 기능이 생겼으면 좋겠어요ㅠ 심장에 무리가 온다아
정선주,4,2018년 12월 3일,2,알람 기능에서 음량조절이 가능했으면 좋겠어요. 작은소리나 불빛에도 예민한 편인데 최대음량으로 알람이 울리니 스트레스에요.
MIHYE KIM,3,2019년 3월 15일,1,텍스트 기능은 이제 쓸수가 없는건가요?말을할수 없는 상황에서 텍스트전달로 이용잘하고 있었는데 갑자기 전달이 안되서 사용이 불편해요.개선이 되지않으면 언어장애가 있으신 분들은 사용하기가 불편할거같아요.
오주희,3,2019년 4월 6일,0,"알람소리좀 낮게 조절해주시면 안될까요?음량을 3,4로 놔둬도 그시간에 일어나집니다.휴대폰 알람처럼 소리조절돼서 아침부터 정신사납지않았으면 좋겠네요 ㅎ"
김근용,4,2019년 4월 13일,0,대화기능이좀 다양했음좋겠네여
덕후,4,2019년 1월 6일,2,멜론 스트리밍권 샀는데 카카오멜론 사용자는 누구못쓰나요?? 카카오로 로그인버튼이 아무리찾아도 안보이네요 ㅠㅠ 방법좀 알려주시면 감사하겠습니다@!
sh kim,4,2019년 4월 17일,2,개인정보 푸시 알림 그만 보내요 오늘 4번이나 왔어요
레혼,1,2019년 3월 12일,5,아니.. 제발 와이파이 연결하는 과정좀 개선해주세요.. 무슨 누구 전원 한번만 껐다 켜도 와이파이 다시 설정해야되는데 와이파이 검색도 한참걸리고 검색 되도 비밀번호 입력하면 무한 로딩걸리고.. 매번 와이파이 정보 바꿔야 연결되는데 정말 불편해요!!! 제발 좀 신경 좀 써주세요
