name,ratings,date,helpful vote,comment
최준희,2,2018년 1월 18일,0,블루투스연결해서 4쉐어드로 노래듣는데  예전에는 끊어지지는 않는데  6개월전부터  노래듣다가 노래가 끊어지고 해서 노래를 듣질 못하겠네요.
오크,1,2018년 1월 13일,0,아니 네트워크연결안되는거 실화냐 서버관리 어케하는거냐 ㄹㅇ 환불각이네
밥됴듁,2,2018년 1월 13일,0,지금 일시오류가 거의1시간째계속되고있는데 저만이상한가요? 갤럭시s7인디
방지환,2,2018년 1월 7일,0,멜론 로그인에 카카오계정로그인이 없어사용을 못하고있습니다 추가부탁드립니다
박수진,3,2017년 12월 24일,0,누구 기계에 음성인식이 갑자기 안되네요..텍스트만되요ㅠ음성으로 이름불러도 안되요ㅠ
M Jay,1,2017년 12월 22일,0,연결 설정을 아무리 다시해도 T맵에서 NUGU실행 안됩니다
우경호,2,2017년 12월 4일,0,"Sk 인터넷 공유기에서는 잘되었는데,, 이사와서 Kt 무선공유기에서는 기기를 인식하지 못하고 있습니다,, 인터넷에 연결이 안되서 그런지 블루투스도 안되고 엉망이네요,,,"
김동균,5,2017년 12월 4일,1,오키토키 무전기 앱 이랑 연동되게 해주세요.
루시퍼,4,2018년 1월 7일,0,혹시 길찾는데 대중교통도 검색해서 가장 적게 걸리는 대중교통만 알려주는 시스템이  있었으면 좋겠어요
WonGi Jo,1,2017년 12월 9일,2,앱으로 원래 무드등 켜고 끄고가 되었는데 업데이트하고나서 안되네요.
황현지,3,2017년 12월 31일,0,음성으로 명령하면 잘되는데 핸드폰으로 텍스트 명령이나 누구앱에서 멜론 음악을 넘기면 아리아에서 실행이 안되네요
핏불치킨시럽,5,2018년 1월 3일,0,이제 사려고 하는데요.. 리뷰를 들어보니 멜론으로만 된다고 하더라구요?? 알송은 되지않는건가요?
김호현,5,2017년 12월 9일,0,최근 노랑색 불이 깜박거리는데 뭔가요?
Young June,2,2018년 1월 11일,0,멜론 자기 아이디로 로그인 했으면 최소한 현재 멜론앱의 자기 재생목록이나 플레이리스트는 플레이 되어야하는거 아닐까요?
Geonung Heo,1,2018년 1월 8일,0,wifi이 변경할려면 NUGU랑 완전히 접속 끊었다 다시 여결해야되네요. wifi설정만 못 바꾸나요?
NIKO니코,3,2017년 12월 25일,0,아리야~ 아리야! 아리야아앜! BTV 소리좀 올려줘~ 현재 지원할수...
박용수,1,2017년 12월 23일,0,비번니들이 설정해주라. ㅋ. 불가란다
조재근,2,2017년 12월 29일,0,티맵과 연동시 전화걸기 기능이 제일 필요한 기능 아닐까요? 그닥 안쓰게됨
페퍼민트,4,2018년 1월 14일,0,안녕하세요^^ 몇가지 질문과 건의드리고 싶은 것들이 있습니다 ㅎㅎ                         1. 음성명령으로 말고 앱에서 노래를 검색할 수는 없나요?                                               2. 기존 멜론 앱과 차이가 많이 나기도 하고 따로 써야 해서 불편한 점이 꽤 있습니다... 기존 멜론 앱에서 바로 누구와 연동이 되었으면 좋겠습니다.                                  3. 누구앱에서 멜론으로 노래를 들을 때 상태바(스마트폰 위에 창에 뜨는것)...전체 리뷰
Google 사용자,5,2017년 12월 27일,8,다음곡으로 넘어가질 않네요
장광남,1,2018년 1월 13일,0,이거통신사다르면안되는건가요?
김댕궁,2,2018년 1월 13일,0,누구 앱을 들어가면 오류가 뜬다고 안들어가져요
Google 사용자,1,2018년 6월 7일,0,업데이트하래서 하니 안되고 제거하고 다시 설치 하니 안되고 쓰라는건지
모모링,5,2017년 12월 4일,1,"노래도 듣고 날씨,알람 등등 너무 좋아요!!!짱짱!!!"
김지한,1,2017년 12월 14일,0,멜론 음악 서치 기능 여주세요
김상민,4,2017년 12월 4일,0,재미있네요.다만 다른앱과연결을많이하네요.
박윤미,4,2018년 1월 13일,0,오늘 누구 이상하네
Google 사용자,4,2017년 12월 23일,0,참으로 좋은것같아요
남성이병남,5,2018년 1월 17일,0,집에서 저도 누구기계 사용하는데 좋아요
김남일,5,2018년 1월 13일,0,지금 앱 접속이 안되네요..
_흥언니,1,2017년 12월 6일,0,음성인식이안되요 하하 아리아라고 애타게불러도 몽알아들어요😢😢😢😢😢
Google 사용자,2,2018년 1월 13일,0,잘쓰다가 서비스 오류떠서 이용 안되는게 나뿐?
Google 사용자,5,2017년 12월 5일,0,로그인같은것 안햇으면좋게어요👍
Google 사용자,1,2018년 1월 13일,1,일시적서비스오류 계속뜨는데 이게뭐죠????
김경호,3,2017년 12월 29일,0,보통이네요
Google 사용자,5,2018년 11월 27일,0,짱~~!!
핑크걸,5,2017년 12월 15일,0,짱이다
박명호,4,2017년 12월 4일,0,좋은데요
Google 사용자,5,2018년 10월 14일,0,개좋음
panda pink,1,2018년 1월 13일,0,앱실행이 안되네요........
Google 사용자,5,2017년 12월 29일,0,좋아요
이육채,5,2019년 4월 22일,0,굿
정진찬,4,2017년 11월 4일,32,티맵과 누구를 너무나도 잘 쓰고 있습니다. 티맵 실행하면 누구와 자동 연동되어서 음성명령(멜론 연동 플레이리스트 실행)이 바로 가능하죠. 근데 폰에서 티맵을 실행하지 않고 누구맵만 실행해서는 바로 음성으로 명령이 안되는 것 같아요. 누구앱을 실행 후 티맵에서처럼 바로 음성으로 명령을 내릴 수 있으면 더욱 더 편리할것 같아요. 그럼 부탁드려요~
햐얀눈송이,5,2017년 10월 30일,12,안녕하세요NUGU앱 개발자님 제가 누구미니를 사용중입니다 하지만 음성활동이 제한적이여서 매우불편합니다. 혹시 개인이 앱에서 자신만의 명령어와 대답을만들고 누구로전송시 제가만든명령어가 작동하면좋을것같습니다 누구개발자님 화이팅!!
Aphrodite 21,5,2017년 12월 3일,1,"인공지능 스피커중에 제일 좋은데, 앱도 잘 만들었네요. 한가지 아쉬운건 스피커니까 다른기능보다 음악을 많이 듣는데, 멜론 기능을 사용할때 멜론앱과 비슷하게 검색기능이라도 있었으면 좋겠습니다."
jeong jik park,2,2017년 11월 6일,7,길안내 언제부턴가 등록도 안된 다른곳만 알려 줍니다...직장까지 물어보면 두산위브주택직장센터 어쩌구 하고 사무실 물어봐도 이상한곳 알려주고 회사로 물어봐도 마찬가지... 블루투스는 지맘데로 연결해제하고 문제가 심각
태용김,3,2017년 11월 19일,0,오늘 연결해서 사용하는데 멜론 인터페이스 연동 오류는 왜 나는거죠? 멜론에 정상 로그인 되는데 왜 어플에서만 안되냐고요. 아직 앱 자체가 좀 불안저완것 같은데 제대로 테스트하고 앱 올리세요! 그리고 결국에는 이용하려는 서비스에 다 가입하거나 유료 연결해야 제대로 사용이 되는형태.
Google 사용자,5,2017년 10월 27일,23,여행을 좋아하는 저에게 는 넘 편리해서 좋아요 근데 몰라서그런지 음악을얘기할때마다 로그인하라해서 좀 불편함 그래도 좋아요^^
주동민,5,2017년 11월 22일,1,누구를 잘쓰고 있습니더 와 인공지능 이 이렇게 발전하다니!... 역시skt답네요 앞으로도 더 발전 부탁드립니당
Kim Regina,3,2017년 11월 13일,0,NUGU 앱에서 멜론실행하다가 앱을 닫으면 멜론이 종료되는건 좀 불편함..아리아 불러서 노래를 듣던 앱에서 멜론을 실행하던 노래가 계속 나왔으면 좋겠는데...앱화면에서 종료가아니고 뒤로가기만 눌러도 멜론이 종료됨. 글고 노래틀고 취침타이머가 있으면 좋겠음. 영어회화를 대화식으로 무료에피소드식으로 공부하게 해주면 좋겠음..
클라스TV,2,2017년 11월 1일,3,그...아이디도쫌빼주세여 정말재밌을것 같은데...아이디랑비밀번호좀 빼주세요 앱을 안봐서그런거지 앱보면 무조건별5개 에요 제작자님 감사합니다 고쳐주세요 제발요..ㅠㅠ
나는내운명,4,2017년 10월 27일,9,운전할때 정말 편리한데 주변 소음이나 음악. 라디오 소리는 줄이고 얘기해야 오류가 없네요
시나브로,1,2017년 11월 5일,1,진짜 집에오면 다시연결해야하고 연결도 계속 오류나고 산거 후회중이에요!!! 폰 계속 다시 연결해야하고 오류나서 탭으로 연결해서 집에 두고 사용할려고 했더니 탭은 지원가능 기기가 아니라고 하네요.. 하.................진짜 왜 이런거죠
손라이,4,2017년 11월 30일,1,누구미니 이것저것 쏠쏠한 기능들이 많아 재미 있습니다. 가끔 아리아도 멘붕은 오나봐요 ㅎ
마하,3,2017년 11월 7일,2,음악 스트리밍 서비스 멜론도 좋지만 sk에서 내세운 뮤직메이트도 지원하면 정말 좋을 것 같습니다! 예정 서비스로 추가 해주세요.
Google 사용자,5,2017년 11월 2일,3,"평소에 잘 되다가 오늘 따라 ""누구서비스와의 연동이 실패하였습니다"" 라는 메시지가 대부분이고 대답을 잘 안받아주네요 ㅠ 기기문제 인가요?"
SeonKi Jeong,3,2017년 11월 4일,1,거실에서 원격으로 특스트 명령을 잘 사용했는뎌 왜 없앴는지 이해가 안가네요. 제가 못찾은건가요.?
이규석,3,2017년 11월 11일,0,앱을 켜면 안드로이드 시스템 웹뷰가 이전버전이라고 자우 뜨네요 웹뷰 업데이트 최신인데.... 왜이러죠
박현우박현우,1,2017년 12월 4일,0,로그인했는데 왜안됐다고하냐고 돈만 받아쳐먹지말고 이런것좀개선해라 적선해준다 더러워서  구체적으로 멜론에서 음악들을때 로그인돼있어도 성인인증이필요하다고만하고 그러는데 좀개선좀해 돈만쳐받지말고 추접한것들아
Google 사용자,3,2017년 10월 29일,2,자꾸 블루투스  페어링?이 준비됬다면서 뭐라하는데 어떻게 해야 할까요?
Google 사용자,5,2017년 12월 21일,0,요즘은  음성인식때문에 먹고 삼니다 배달네비를 하루종일 보는대 음성으로 찾으니 업무가 마니 빨라졌서요
조준석,3,2017년 10월 30일,2,디바이스를 계속 못찾는다고 하네요 분명 연두색 불빛도 들어와있고 와이파이랑 위치정보 다켯는데도
Muso Ki,5,2017년 11월 29일,0,네비 기능으로 손색이 없네요.주소록에 있는 번호로 전화걸고 문자 발송 가능하게 해주세요.
김멐뛻,3,2017년 11월 5일,0,왜 텍스트명령이 안되죠..? 또 알람 시간을 어플에서 변경하려는데 어플에서 변경못하나요? 시간 눌러도 아무 버튼이 안뜨는데..
오주현,5,2017년 10월 26일,6,새로운 편리함이 생기네요 좀 여러가지 조건도 같이 검색되면 좋겠네요
Yongchang lee,3,2017년 10월 28일,0,네이버에서 만들었으면서 캐린더는 구글을 쓰는 이유가 멀까요?
정윤태,3,2017년 11월 22일,1,이 앱을 쓴다는건 누구 디바이스를 쓴다는거겠죠? 써보니 '누구  ' 참 계륵같습니다.  1.고속충전기 사용하면 안됨 -요즘 시대에 느린걸로 충전안하면 고장나게해놨음 (이거 때문에 교환받음) 2 배터리 잔여랑 확인 이딴거없음 더군다나 충전 되고있는지 확인할 표시도없음 3 소리작게 크게 음성명령으로 답답해서 못함 . 볼륨단계가 10단계는 될껀데 '아리야 소리 작게' 5초 걸려서 말하면 한단계만 작아져서 답답해서 말로못함 4 노래틀어주는건 멜론이란 표현안해도 잘되는데 정보 찾아달라고 하는거는  '위키에서'라는 말을 꼭해야함 어르신들도 자...전체 리뷰
Google 사용자,1,2017년 11월 16일,0,이거 디바이스 연결에 와이파이 비번까지 쳤는데 그 뒤로는 계속 진행이 안되네요 시키는대로 했는데 인터넷 연결을 할수없다며 혼자 연결을 종료 시켜버립니다 비싼 고철덩어리 산 기분이네요ㅜㅜ
이영림,2,2017년 10월 31일,0,아이콘 편집이 안됩니다 알람설정 변경이 안됨 ㅜㅜ
쭈오,1,2017년 11월 21일,0,자꾸 옆집 와이파이로 연결됨 ㅁㅊㅡㅡ
이승재,1,2017년 11월 24일,1,네트워크 지연 아예 먹통되버리네
사람,1,2017년 11월 29일,0,디바이스연결에서계속막혀요 ㅠㅠ
Google 사용자,5,2017년 11월 3일,1,음성을 이용한 편리한기능에 매우 만족합니다
롤초보,5,2017년 12월 3일,0,좋긴좋은데 멜론가입 되어있어야만 노래를 들을수있는건가요 모든노래를요  멜론을사야지되는건가여
뷔정상,5,2017년 11월 13일,0,이번에 방탄 광고에서 나와서 꼭 해보고 싶엏는데 너무나 조아요 진짜 심심할때도 재미있고 너무나 조은 앱인거같아여
Google 사용자,3,2017년 11월 21일,0,누구 호출 인식어 늘려주거나 제가 원하는걸로 만들스있게 해주세요 원래 호출어가 정해져있는줄 모르고 부르고싶은 이름 있어서 샀는데 4개중 하나만 선택할 수 있어서 너무 아쉬워요 그리고 누구 미니인데 노래 틀어놓으면 제 목소리를 잘 인식을 못해서 다섯번도 더 불러야 하는건 좀 짜증나는데 그것 말고는 괜찮게 쓰고있습니다
김혜정,3,2017년 10월 30일,1,벅스도 생겼으면좋겠어요 벅스도 멜론처럼 추가해주세영
Lay Kim,2,2017년 11월 23일,1,음성인식 너무 안좋음. 기능 쓸만한거 없음
이름없음,5,2017년 10월 31일,0,저기 꼭 멜론으로만되나요? 벅스로는 안되나요? 그리고 기기를2개해도되나요?
Juitem kim,1,2017년 11월 12일,0,갤럭시탭S3 에서는 호환이 안되네요
Google 사용자,5,2017년 10월 29일,1,좋은 세상이 만들어 지네요.
김형균,3,2017년 12월 6일,0,핸드폰에 저장된 음악도 재생할수있는 기능도 있었으면 좋겠어요
전용병,5,2017년 11월 12일,0,머리아프네요
Google 사용자,1,2017년 11월 4일,0,sk만되는지 kt는안되요?
Google 사용자,5,2017년 11월 7일,0,티맵과 연동되어 쓰기가 좋아요
양종훈,5,2017년 10월 26일,2,최고의app인듯
김경호,5,2017년 10월 30일,0,GOOD!
류삼휘,5,2017년 12월 6일,0,진짜 너무좋은데 이름은 못 바꾸나요?
이이정현,4,2017년 10월 30일,0,운전시 아리아가 편하고 좋아요!
뚱이사랑한닥,5,2017년 11월 3일,0,최고 오늘 하루 잘 보내셨나요
Google 사용자,5,2017년 11월 26일,0,고맙게 잘 사용하고 있습니다
Google 사용자,5,2017년 11월 9일,0,맘 에드먼드
keun chang choi,3,2017년 11월 15일,0,익거 맘에 드네요
Google 사용자,5,2017년 11월 3일,0,넘좋아요 ㆍ네ㆍ네ㆍ네
노현우,5,2017년 11월 12일,0,좋네.
이근석,5,2017년 10월 28일,0,편합니다 좋아요 굿
유재우,5,2017년 11월 21일,0,좋타
권영삼,5,2017년 10월 26일,4,간편함
배현근,5,2017년 12월 29일,0,최고예요
최별송,5,2017년 12월 5일,0,좋네요
김현욱,5,2017년 10월 29일,0,좋아요
Google 사용자,5,2017년 10월 28일,0,좋아요
박상영,5,2017년 12월 5일,0,좋아요
김대영,4,2017년 11월 10일,0,좋네요
박진수,5,2017년 12월 4일,0,좋아좋아
윤영호,1,2017년 10월 11일,25,인터넷 연결할 수 없다는 메세지와 앱의 와이파이 찾기가 무한루프를 하고있다. 어떻게 하면 편하게 사용할지 어떻게 하면 쉽게 살정할지는 당연히 연구했을텐데.. 폰을 얼마전 v30으로 바꿨는데 그래서 않되는 거냐ㅡㅡ;; 도데체 머냐.. 무한루프 지겹다..
DH WON,2,2017년 10월 7일,13,인공지능 보다는 음성인식 멜론플레이어 랄까? 음악 들으려고 구매했는데.. 물어보면 대답해줄 빅데이터 자체가 존재하지 않는거같네요. 누가 위키 검색이나 하자고 이걸 살런지..
안이슬,5,2017년 10월 6일,2,플레이리스트 틀어줘 하면 어떨땐 바로 젤 위에껄 들러쥬는데 어쩔땐 총 23개의 플레이리스트가 있습니즈 첫번째 ㅇㅇㅇㅇ두번쨍ㅇㅇㅇ세번쨍ㅇㅇㅇ다음목록을 들으시려면 다음이라고 말씀해주세요 이러는데... 질 첫번째껄 듣고싶으면 어떻해하나여 이랫다저랫다 함
김민철,2,2017년 9월 30일,72,모델이 SM-T365F0 인데요. QM3자동차 네비로달려있습니다. 이런기능은 위모델에 더욱 필요한 기능인데  지원하지 않는다니 참 안타깝지만 지원할 계획은 있으신지 궁금합니다.
사랑샤샤,4,2017년 10월 13일,1,제가 주로가는  버스정류장의 고유번호로 등록하고 몇번의 버스가 몇분후에 도착하는지 시간을 알려주는 방법은 없나요? 없다면 향후 개선될 수 있도록 부탁드립니다
박정수,2,2017년 10월 25일,0,"알람을 멜론 노래로 선택할려하는데 이전 버전은 쉽게 되었는데, 업데이트 이후로 알람설정을 찾을수가 없네요. 그리고 목록표시 편집후 저장을 하여도 반영이 되지 않습니다. 사용하기 너무 불편하네요"
원승연,2,2017년 9월 30일,74,Btv 연동이 티비에선 되있는데 앱에선 안되있어서 연결해제를 하라 해도 아무것도 못하겠네요ㅜㅜ 어떡하죠?? 인증번호도 몰라서 연결도 못하는데..
백남구,4,2017년 10월 1일,32,하루정도 잘쓰다가 갑자기.얀결이 끊겨서 니것저것 해봤는데 보니까 디바이스.연결할때 누구.와이파이가 연결되다가 바로끊겨버립니다.해결책좀...
Cho Myaung Chan,4,2017년 10월 1일,2,집에서 와이파이로 하고 밖에서 사용할려면 와이파이 설치된장소에서 해야하는데...밖에서 어디서든 할수있게 데이터로 사용가능케는 안될까요?
이규희,4,2017년 10월 8일,3,1.구글 캘린더 연결 안됩니다. 에러 발생. 2.음악은 멜론만 되네요.  폰에 있는 다운받은 파일 듣고 싶어요
Ju Hyong Lee,1,2017년 10월 5일,3,아리아를 불러야 대답하는거 아님가요??? 갑자기 답변을 할수없다고 하는데 왜그런건지요??? 그리고 집안에 사람없을때 집에퇴근하고 들어오면 계속녹색불이 들어와 있늠데 왜그런거죠???
지우의일상,4,2017년 10월 4일,2,누구앱으로 누구와 공유기와이파이를 연결해야하는데 디바이스찾기까지는되는데그다음에 nugu_000000 와 누구앱이 연결이 안되어 그다음진행이되지않아요 저게연결된뒤에 공유기와연결하는걸로아는데 저거랑도 연결이 안되니 공유기와의연결은 시도도해보지 못했습니다
Seungcheol Na,4,2017년 10월 22일,0,알람목록 전부지우기 기능 추가해주세요. 잠잘 때 몇시에 깨워줘 하고 자는데 두달만 지나도 60건입니다. 60개 하나하나 지우려니 오래걸리고 번거롭네요
spikes tactical ar15,4,2017년 10월 8일,0,굉장히 좋습니다. 하지만 티맵을 설정할때 노래설정에서 멜론로그인 할때 멜론계정말고 카카오계정도 되게 해주시면 안되니요?
야구하는 남자MAN,4,2017년 9월 30일,2,다좋은데요 t map에서 사용중인데 누구한태 전화해줘하면 전화걸릴수있도록 해주세요ㅠㅠ
이정호,4,2017년 11월 3일,0,음성활동은 제한적이긴 하나 운전시 사용할때 주유소 충전소 운전하면서 위험하게 찾을필요없이 가까운거리부터 금액대별까지 나오니 운전하면서 정말 편하고 좋아요.
김도훈,2,2017년 10월 2일,1,누구 앱에서 음악검색은 안되나요? 누구 음성인식이 잘안되서..ㅠㅠ
구진화,2,2017년 9월 30일,4,아디 비번 로그인만한건데 종료만되네요 !!  왜 그련지 모르겟네요! 팅기기만 하네요!!
양짱TV줄넘기달인,2,2017년 10월 8일,1,"SKT에서 제공하는 어플임에도 불구하고 뮤직메이트, T인증 어플들이 지원이 안됨 무늬만 SKT어플"
이재홍,4,2017년 10월 7일,0,안녕하세요 티맵과 연동해서 사용하고있는데 영화나 그 외 기타기능은 사용 활성화가 안되는데 왜그런건가요?
유영은,4,2017년 10월 10일,0,"근데, 휴대폰 번호로 로그인할려는데 밑에 비밀번호라고 나오는건 뭐죠? 혹시 인증번호를 입력하라는 건가요? 그렇다 해도 인증번호가 안와요!"
라라라,1,2017년 10월 6일,0,파란불은 들어오는데 계속 연결이 안된다고 하네요 ㅡㅡ 두시간째 잡고 있는데 열받네요
이상웅,3,2017년 10월 5일,0,Sk 누구...  작년 말에 사다가 얼마 사용안하고 그냥 방치해둔 상탠데요...skt는 벅스랑 제휴해서 이용하는데 이점이 있는디 누구는 왜 멜론으로 해두셨을까여...내일모레 군대가는데 제대하고선 벅스류 바뀌었으면 하네요
똥듀[똥꼬발랄 듀히],2,2017년 10월 15일,0,디바이스 연결 찾기라 돼있는데 초록색도 안올라가고 무한반복되요 어떡해하죠?
Google 사용자,2,2017년 10월 22일,0,노래 재생때 리스트 중간노래 선택 해서 듣다 보면 한곡 재생만 되요  전체 리스트 재생 좀 해주세요
Dong-Woo Lee,3,2017년 10월 1일,2,벅스랑 스트리밍 요금제 출시하고 음악서비스는 멜론이랑 하네요... 선택가능하게 해주세요..
보조비트,1,2017년 10월 4일,0,이런앱이있으면 s8 노트8 산사람은 뭐가됌 빅스비  시바18
뜌요밍,2,2017년 10월 22일,0,"처음 연결시키고 몇일간 쓰다가 멜론틀면 끊기고 혼자멈추고 그런일이 다반사. 후에 모든 경우에 찌직 버퍼링 걸림. 그래서 끄고다시시작한 후 연결하려니 블루투스말고는 죽어도안됨 4일째 인터넷연결이 안되어서 돈내놓고 못쓰는중. 티비도 인터넷도 본가랑 지금자췻방에서 모두 sk사용하는데 자췻방은 기업가입자라 누구랑btv연동도 되질않는다하고; 제가 sk에 내고있는 돈이얼만데 제대로된게 별로없네요. 기업가입자면 제가 다달이 내고있는 인터넷,티비료는 돈도아닌가요ㅜ 혜택이없네요. 제대로 안되는거면 인터넷이든 누구든 출시를 말았어야죠. 언제쯤 인터넷...전체 리뷰"
김상락,5,2017년 9월 27일,18,대박 드디어 똑똑한 비서를 찿았네요.퓨하하
샘아부지,5,2017년 10월 9일,0,"오늘 첨 접했는데 아주 좋네요.단,지도찾기에서 새로운 경로 안내가 늦네요.😁"
공연리뷰,5,2017년 10월 24일,1,폰에 누구깔고 블루투스 스피커를 연결하면 누구 기기랑 똑같이 사용 가능한가요?
이응선,3,2017년 10월 3일,0,티맵 사용중인데 멜론 nugu 스트리밍상품 구매가 안됩니다 .선택된 Nugu 에서는 해당상품을 구매할수 없다네요.. 어찌 구매할지요?
박호춘,5,2017년 10월 26일,3,연결이 잘되는 곳에 있어서 사랑해
장준규,5,2017년 10월 7일,0,날짜 읽어줄 때 너무 빨라서 듣기 어려워요. 연원일 읽어줄 때 사이에 조금 여유가 있었으면  합니다.
모모,4,2017년 10월 18일,0,미니 누구 사용중인데 디바이스 동기화에 실패했다면서 안됩니다ㅠ 또 일본어 사전도 추가해주세용
익명,4,2017년 10월 22일,0,멜론을쓰지않으니까 노래를구매해야되는데 폰안에 있는음악을들을수있으면좋을거같아요.
최성호,1,2017년 10월 27일,0,전세집에서는 사용 불가 운전중에는 걸리적
김지훈,2,2017년 10월 2일,1,아리가 말을 잘 알아듣지 못하는건 저만 그런가요?
아리아나TV,1,2017년 10월 21일,0,아니 t아이디 로그인 했는데 왜 안돼요?
김광훈,4,2017년 10월 9일,0,Nugu 멜론에서 이용권 구매 안하고 다른  멜론 어플에서 이용권 구매하고 그 멜론계정을 nugu에서로그인해도 무제한 듣기가 되나요?
김용호,5,2017년 10월 25일,0,오....전반적으로 만족 연결빠르고 한번에 찾아주고..운전하면서 이래저래 귀찮을일이 사라져서 좋네여
진수김,3,2017년 10월 9일,0,아리아!라고 호출까진 되는데 이후에 명령이전혀듣질않습니다 기종은노트4입니다
Google 사용자,5,2017년 10월 27일,1,애들이 넘좋아  해요
hongseok kim,3,2017년 10월 3일,1,남자 목소리는 없나요? 아리가 남자비서이길 원하는 건 저뿐인가요?
Junseok Kim,5,2017년 9월 27일,4,비서가 똑똑해요
난엘프,1,2017년 10월 19일,1,Nugu가 점점 멍청해짐..
Google 사용자,4,2017년 10월 13일,0,좀더  쓰고  남겨야함
김영진,5,2017년 10월 10일,0,아~ 넘 편리하고 좋아요 T맵의 신세계를 보았네요
정양완,5,2017년 10월 2일,0,올추석 고향길 함 써볼랍니다
양영식,5,2017년 10월 3일,1,ㅇ음성인식 넘잘되네요.굿
핫핫,5,2017년 10월 12일,0,좋은앱이지만   영화 검색할때 세종이 없네요 추가해주세요!
윤태진,4,2017년 10월 8일,0,잘 사용하면 운전에 도움이 될 것 같아요
QSang Ko,5,2017년 10월 7일,1,벅스 연결해 주세요. 언능요.
박종군,4,2017년 10월 14일,0,로그인하기어려워요
Google 사용자,5,2017년 10월 26일,0,음성인식이 영어는 잘 못함
박미숙,5,2017년 9월 29일,0,너무너무 굿입니다  초보운전자에게 굿짱
김평수,5,2017년 10월 1일,1,최고네요~~!굿
이영선,3,2017년 9월 28일,0,오리역안내하면서 저절로 실행됩니다;
임미노,4,2017년 11월 5일,0,2%부족
