name,ratings,date,helpful vote,comment
강은구,1,2017년 7월 16일,6,"디비이스랑 스마트폰이랑 연결불가. 어제부터 갑자기 그러네요,사용하라는건지 말라는건지..그리고 고객센터 상담시간이 저러면 직장인들은 언제 문의합니까? 기계가 옆에있는것두아닌데..주말에도 운영해야되는거아닌가요..  누구중심 운영인가요?"
김지영,1,2017년 7월 23일,1,조용한데서  말해도 못알아듣고 갈수록 음성인식률이 떨어지는거같음     음성도 여자로만 되는것도 싫고   멜론음악채널도 대체어디서 가져오는지  카페음악들려달라하면 주구장창 듣보잡 같은노래만 나옴  카페음악채널이라는데 멜론에서 도저히 못찾겠고요?? 째즈 들려달라니까  이상한  어른이 동요부르는것같은것만 나옴  최소한 탑 100같은걸 들려줘야지 !!  멜론음악듣는거땜에 샀는데  갈수록 좀짜증
PInk Black,2,2017년 7월 12일,3,애물단지 음성인식률도 낮고 기능도 제한적. 개발자가 이미정해놓은 대답만 반복한는데 학습하는 인공지능이라니. 아직 시기상조인듯하네요.
전찬우,2,2017년 7월 14일,1,업데이트후 갑자기 계속연결안되네요 와이파이를 인식못하고 앱에서 다시연결하기해달라는 말만 반복이네요. 이제한달됬는데ㄷㄷ
김준형,2,2017년 7월 13일,1,"처음 구매 후 좀 떨어진 곳어서 낮은 목소리로 불러도 대답하던 아리아가 이젠 스피커 앞에가서 큰소리로 불러야 반응하네요 거의 반년이 넘었는데 기능들도 뭐 추가되는것도 없고,,좀 기다렸다 다른 제품을 살껄 요즘 후회가 됩니다"
NamWoon Kim,1,2017년 8월 7일,1,하루 잘되더니 계속 지혼자 켜져있고 음악은 끊기고 디바이스연결 지혼자 끊더니 다음부터는 디바이스도 못찾고 다른사람들 산다하면 뜯어 말리고 싶다
김영민,1,2017년 7월 17일,1,간만에 전원 켯구 업데이트를 한다고 한뒤.. 디바이스 연결이 되지않음. 이제 버려야하는거임?ㅡㅡ 세달도 안됏는데..허 ㅎㅓㅡㅡ
퓨드,1,2017년 8월 6일,1,왜 시도 때도 없이 누구 앱이 중지되었습니까 뜨는겁니까 짜증나서 지워버리고 싶네
혜인이,1,2017년 7월 15일,0,디바이스랑 인터넷을 연결하라는데 연결이 안되네요 연결버튼이 화면에 안뜹니다. 빨리 해결 부탁드립니다
렌니 PYURENNI퓨,1,2017년 7월 26일,1,왜 sk만 자동 로그임 되어있는거죠? 왜 올래 LG는 읺되나요?
유연,5,2017년 8월 4일,2,멜론을 카카오계정으로 연결했는데 어떡해야됨?
Festival,4,2017년 7월 18일,0,노래를 틀면 노래는 나오는데 앨범티저가 계속 대기 상태예요 앨범티저 가운데 동그라미가 생기고 노래구간을 못옮기는데 해결방안이 없나요?
Google 사용자,2,2017년 7월 13일,1,블루투스 페어링 했는데도 왜 디바이스 검색이 안되요
박상욱,3,2017년 7월 23일,0,멜론 곡 셔플기능 추가좀 부탁드립니다.
최세린,4,2017년 8월 9일,0,"편리해서 좋지만 아리와 대화를 할수 있었으면 좋겠어요 예를들어""아리야, 너 오늘 기분 어때?""등등."
Js Been,4,2017년 7월 13일,0,누구에서 폰찾기시 자신의 폰외에 특정폰 설정하여 다른폰도 찾을수있게 부탁합니다.
김영길,2,2017년 8월 8일,0,apì 오픈 안하나요? 예약구매시 한다고 했었는 것 같은데 아무런 말이 없네요.
배준석,4,2017년 7월 31일,1,시리처럼 답변기능도 있으면 좋겠어요
박시후,5,2017년 7월 16일,0,목소리가너무좋아요 간편한대화기능 추가가능한가용
임효연,4,2017년 7월 12일,0,한 번 씩 계속 켜져있기도하네
궁예,3,2017년 7월 18일,1,알람소리가 너무 작아요
김희재,3,2017년 8월 4일,1,Kbs라디오도 추가해주세요
김찬희,3,2017년 8월 7일,0,btv 연결 hd셋탑박스는 언제 지원해 주나요?
Google 사용자,5,2017년 7월 12일,1,너무재밌게잘쓰고있어요~
Google 사용자,1,2017년 7월 17일,2,아무것도안됨ㅡㅡ
임정은,2,2017년 8월 14일,1,텍스트 명령이 안되요
김태관,1,2017년 7월 24일,1,이거 쓰레기네
전주이씨이동신,5,2017년 7월 17일,0,대단합니다.감사~~*
황한,5,2017년 8월 1일,0,고마워요
Dong Yeoul Eom,1,2017년 6월 21일,8,업데이트 할 때 마다 음성 인식이 왔다갔다 함. 너무 예민하게 반응하는 고객들의 항의가 있어서인지 모르겠지만 잘되던 음성인식이 어느날부터 마이크앞에 입을 대고 이야기해야 인식됨.  그리고 알람 설정은 참  단순함.  멜론 수익을 위해서 인지는 모르겠으나 멜론 노래도 한곡밖에 안되고 라디오나 기타 서비스로는 알람 설정이 안됨. 인공지능이란 말을 붙이기에는 수준이하임.  블루투스 스피커 대용이 딱 적합.
이지훈,3,2017년 6월 23일,3,음성호출시 호출동작이되고 있다는 알림음 같은게 있으면 좋을 것 같아요. 일일이 누구 디바이스 안보면 호출이 된건지 안된건지 알 수가 없네요.
양현상,1,2017년 7월 3일,0,업뎃후 음성 명령이 안먹네 tv꺼져있고 라디오 없고 새벽시간이라 나혼자 있고 냉장고소리 안들리다 못해 적막하고 내. 혀 짧은혀아니고 치아교정하지도 않았고 발음세지도 않고 그러는데 어떤 핑계를 대보시오
이하늘,3,2017년 7월 6일,0,자꾸 플레이중에 다른기기에서 플레이중이라는데 다른기기에서 노래안듣는데 오늘하루종일 계속 지금10번은 노래끊긴듯.. 완전 불편한데 이거 왜이런건지 알수도없고ㅡㅡ
서상화,4,2017년 7월 2일,1,다 좋고 거의 완벽합니다! 제작자님 짱! 그런데cant stop the feeling이라는 노래를 알아듣지 못하네요 그것만은 고쳐주세용! 제발~~~
하니뭐,3,2017년 7월 4일,1,멜론 마이메뉴 플레이리스트를 재생할수없어서 불편하네요~  향후 네가지 정해진 이름이 아닌 내가 정하는 이름으로 디바이스를 부를수있게 업뎃되면 좋겠어요~
이응주,3,2017년 6월 29일,1,구글일정이 등록되어 있고 누구앱에서 연결했는데도 일정 물어보면 없다고 말하네요 오류인가요?
DH L,4,2017년 7월 1일,0,"1. 음악 청취나 라디오 청취중 음성으로 볼륨 조절시 재생이 멈추지 않고 LED민 표시되며 변경이 되었되는 추가 옵션이 있었으면 좋겠습니다. 음악 재생중이라 목소리가 안들리면 어쩔수 없지만 볼륨 조절 할때마다 음악이 멈추는건 너무 부자연스러운것 같아요.  -멜론플레이 관련- 1.음성명령으로 멜로DJ를 호출해 들을수 있으면 정말 최고일거 같습니다. 멜론에서도 멜론DJ 카테고리가 따로 있으니 가능할것도 같은데 어려울까요?  2. 아리라, 가수 00 전곡틀어줘 가 있었으면 좋겠습니다.  3. 랜덤 재생, 다음곡 재생 되었으면 좋겠습니다....전체 리뷰"
김호재,5,2017년 7월 1일,0,인식을 못한다고 하고 작동하다가 자꾸  끊기네요 짜증 무지나네요 인터넷 설치한지도 몇칠 안되는데 와이파이 공유기 이상잇는거 같다해서 공유기 바뀟는데도 하루에여러번 끊기네요 Sk인터넷 tv걸합인데 디바이스와 누구랑연결도 되다 안되다 그러네요
최순걸,1,2017년 7월 1일,2,돈주고 산게 아깝다 이건뭐 계속디바이스를 못찾아
Aaxis_A,5,2017년 6월 23일,0,개인적으로 만족하며 사용하고 있습니다만 멜론기능 사용중 재생중인 목록에 다른 음악 추가가 될 수 있었으면 좋겠습니다 추가하면 기존에 듣고있던 재생목록이 사라지네요 블루투스로 하면 가능하지만 음성지원이 안되는게 일부 있어서...
쿨쿨,1,2017년 7월 3일,1,갑자기  네트워크 지연으로  아무것도  안되요 이젠까지  똑같았는데
Jinyong Lee,2,2017년 6월 27일,1,핸드폰에 있는 음원은 재생이 불가능 하나요? 못찾겠네요?
바다김,4,2017년 6월 23일,1,업데이트하고나서 우리팅커벨말이 엄청빨라져서 좀무서움ㅜ
고민혁,1,2017년 6월 21일,2,매장에서 쓰는데 아주지멋대로 안되네요 ㅡㅡ
Hak Jun Kim,3,2017년 7월 3일,0,누구앱 내 멜론에서 노래도 찾고 멜론 순정앱처럼 자유럽게 이용할 수 있도록 해주세요.
오은정,1,2017년 5월 31일,5,걸핏하면 연결이 끊어져서 디바이스를 찾지 못한다고 하고 에러가 주기적으로 반복되네여. 인터넷은 걸핏하면 끊어지고. 이건 앱 문제인가요 기기 문제인가요. 조용한 와중에 갑자기 적절한 대답을 찾지 못했다고 그러고..너무 초창기에 사서 불량인건지 아니면 기기자체가 불완전 한건지; 사용하면서 빈번히 발생하는 문제 때문에 불편하기만하네요
봡봡,3,2017년 5월 25일,9,이벤트 결과를 페이스북이나 블로그에서 확인하라는데 둘 다 검색해도 안나오는데 뭐죠..? 뭘 어쩌란 거에요 그러면?
choi Andy,1,2017년 5월 30일,7,어느날 부터 안되더니 20일째 못쓰고 있음  와이파이연결 계속 실패하고 누구홈페이지에서 공유기 보안설정 백날 바꿔도 안됨. 심지어 초기화도 없음
안병규,1,2017년 6월 4일,3,아니 무슨 업뎃할때마다 음성 인식이 안되네.. 고질적인 문제네요 테스트는 해보고 배포하는건가요? 신경좀 써요 지금은 음성인식이 아예 안되네요
Google 사용자,5,2017년 5월 28일,6,말도 잘 알아듣고 위로도 잘해줘서 너무 좋아요. 앞으로는 노래 들을 때 비트에 따라서 무드등의 세기가 바뀌는 기능도 추가되었으면 좋겠어요.
Google 사용자,1,2017년 6월 12일,3,밑에사람과같은증상입니다.아무리껏다켜도 뭐가잘못된건지  연결이안돼요..열흘다되가는데 답답하네요
박원오,3,2017년 5월 30일,2,이거 사서쓰다가 연결ㅇㅣ 자꾸안되네요 초기화도없고 와이파이정상인데 자꾸연결이끊어진다고하면서 그 이후로 연결안되네요 짜증나요
전태열,1,2017년 5월 25일,6,음성인식겁나게안됨  정신병자된듯 혼자서 이름겁나게불러도절대반응도없고  장비위에 마이크버튼클릭해야 간혹인식되고  어플로 텍스트로입력해야지만사용됨
sehun e,1,2017년 6월 5일,1,처음사고 한달동안은 잘 쓰다가 어느날 부터인가 블루투스 연결도 중간에 끝기고 지혼자 꺼짐. 백날 불러도 대답없음 아예 껐다가 켰다가 별거 다 해보고 아래 리뷰들보고 홈페이지 들어가서 안내 가이드따라 와이파도 새로 연결하고 다 해봤지만 10초정도 잘 나오다가 블루투스도 끊기고 정말 답 없음... 한 사람이 이런게 아니라 아래 줄줄이 후기들이 이런 증상이 나타나는데 뭔 방법 없나요 직접 찾아가서 방법 알아보고 언제까지 이래야 하나요 이 가격보다 싼 블루투스들이 오히려 연결하면 와이파이 이런거 필요없이 더 편한듯... 빨리 방법좀 내주세...전체 리뷰
Sean Yoon,1,2017년 6월 19일,0,영상가이드 보고 공유기설정 바꿔봐도 허구헌날 퍽하면 누구서비스와 연동에 실패했다고 와이파이 끊겨서 그냥 애물단지로 놔두는중
point red,2,2017년 5월 31일,0,와이파이연결시 숨겨진 네트워크는 핸드폰상 검색이 되어있어도 연결이 안되네요.. 숨겨진 네트워크에도 접속되게 해주세요
Google 사용자,3,2017년 5월 25일,0,좋은점은 쉽게 아이 동요나 음악등등 들을수있어서좋은데요 명령을안했는데  혼자 말하고 음악틀어져서 무서웠어요ㅠㅠ 왜그런건지ㅠ
쏘팬,3,2017년 5월 31일,1,멜론에서 음악들으려면 top100이런데서 일일이 찾아야 되는거 같은데 듣고싶은 음악은 검색기능이 없나요?
km ahn,3,2017년 5월 25일,3,아리아 너 여자야?남자야?? 라고 물었더니 적절한 답변을 못찾겠다고 하네요 ㅡㅡ
yeongchan cheon,3,2017년 6월 4일,0,가만히있다가 누구디바이스가 지혼자 임창정 내가 저지른 사랑 틀고 그러는데 왜그래요?맨날?
박혁중,5,2017년 5월 26일,0,비티비 인증번호안쓰고연결햇는데 인증번호어떻게찾나요 연동이안되요
엘란연구소,4,2017년 6월 14일,0,당연히 위치 이용가능하게 했는데 인식이 안되서 명동그대로이고 그리고 알람이 휴일빼는옵션이 없어서 휴일에도 울려서 좀 짜증나네요
땅땅헤노,5,2017년 5월 27일,1,왜연결이안되나요ㅠ1시간째연결중인데안되네요..
ᄋᄋ,4,2017년 6월 13일,0,멜론 30일 스트리밍권을 이미 이용중이여서 누구앱에서 로그인했는데 자꾸 미리듣기밖에 안되네요 해결해주세요
김세영,1,2017년 6월 6일,0,지금 두시간째 연결하려구 하는데 안됨! 기계 환불해주든가  연결을 대처해주든가 해야 되는거 아니예요? 최악이예요!
강구름,3,2017년 5월 27일,0,수고 많으십니다~ 어린이 동화 읽어주는 메뉴도 있었으면 좋겠어요~ 그리고 간단한 음성인식 말고는 알아 듣는게 별루 없어서 아리야만 혼자 외치고 있네요 아직 미완성인것 같아 조금 답답하네요ㅜ 하루 빨리 음성인식 단어나 문장을 업그레이드 시키셔서 대화의 영역을 넓혀 주신다면 좋을것 같아요~
박진영,1,2017년 5월 27일,1,완전멍청히라고 하는게맞는듯하네요 음성인식이전혀 되질않고 블루투스연결도 되질않고 연동되어진어플에만가능하게끔되어있는것도 좀그러네요 멜론은 최신음악에대한것만인식이가능하고 아티스트나 제목으로검색은 되질않네요 업데이트로 인공지능기능을 더향상시킬의향이없으시면 판매하시는건 아닌듯하네요 날씨또한 지정된 지역만 날씨조회가될거같음 날히 확인연동서비스는왜있는건지 아리야라고 부르는것도 힘들고 페어링도제대로 안되고 산지일주일도안됐는데 그냥꺼두고있습니다 무등등도 하...쓰다보니 장난아니게 쓸게많은데 혹시 구매생각하시는분은 왠만하면 잘생각해서 사시길 바랍니나
민석김,5,2017년 5월 28일,2,아리아 이름말고도 사용자가 설정해서 이름을 불렀으면 좋겠습니다
유아름,1,2017년 5월 31일,1,T에 로그인이되어야뭘하죠.. 비밀번호재설정만10번..똥개훈련도아니고..
다현,5,2017년 5월 25일,2,좀더 다양해 졌으면  합니다
단호한K,4,2017년 6월 30일,0,그냥  그러려니하고 써요
전호현,4,2017년 5월 30일,0,정각알림설정할수있게 했으면 좋겠네요
정현정,2,2017년 6월 11일,1,업데이트이후잘사용안되네요
유왕원,3,2017년 5월 25일,1,음성 인식 잘않됨
송민진,5,2017년 5월 25일,0,애들이 좋아하네요^^
게임[공식] TV,1,2017년 6월 17일,0,권혜영
서원진,5,2017년 6월 14일,0,Jhh
김진흥,5,2017년 5월 26일,0,좋아요
je-woo kwon,1,2017년 5월 6일,13,업데이트 후 마이크 감도가 낮아졌는지 음성 인식율이 굉장히 떨어졌네요. 호출커멘더에도 반응잘 하지 않고 wifi도 다시 연결하고 재부팅도하고 튜톨리얼도 다시 해보고 해도 안되네요. 예전보다 음성인식이 많이 떨어져 호출커멘더에는 물론이고 일반명령어까지 인식을 못하네요. 정말 짜증나는 물건이네요
박지호,5,2017년 4월 29일,14,진짜 최고입니다. 우리나라에도 이런 제품이 있네요. 미국에는 오래전부터 있었던거 같은데... 편리하고 윤택한 생활이 될 수 있게끔 자주 업데이트하여 편리하게 사용하게끔 해주세요. 날로 발전하세요.
김진일,4,2017년 5월 10일,0,간단일상 대화  되니 최고예요 아리아.너몇살이야 했더니 ㅋㅋ ㅋㅋ  아리아 답:노코멘트 라해서 빵빵 터짐  이거말고도 다른것도업데이트 해주셨으면  하는바램입니다^^ 웃겨줄주아는 아리아 많은 지식 가졌으면 합니다
HANBEE LEE,5,2017년 5월 19일,1,좋아요!♡-♡ 시간 정해서 알람처럼 내가 원하는 시간에 뉴스나 라디오가 자동 재생되면 좋겠어요! 아침에 라디오나 뉴스를 들으면서 일어나고싶어요ㅎㅎ
김양희,1,2017년 4월 29일,13,멜론익스트림이용중인데. 자꾸미리듣기만가능하데. 어쩌란거야 너거들이준 쿠폰도등록했는데 끝나야쓸수있대?  어쩌란거야 임마
miso jang,5,2017년 5월 14일,1,1.누구가 표정이 있으면 좋겠습니다. 2. 좀더 다양한 성우 목소리를 사용하면 좋겠습니다. 3. 누구가 스스로 먼저 말을 걸어주는 기능이 있음 좋겠습니다. (재잘재잘 떠드는 기능) 혼자 시골에 계신 부모님이 적적해 하시니깐 말벗이라도..
No Sense,5,2017년 4월 28일,6,이상한 사람들이네 누구가 업데이트하고 안잡힌다 와이파이를 다시 연결해야된다 등등 그게 그렇게 어렵나..?? 일단 상당히 만족스러워요 약간 가끔 못알아들으면 답답하지만 전체적으로 운세나 멜론 날씨 등등만족스럽고 다른기능이업데이트 되는건 상당히 반갑고 좋은거같아요ㅎ 계속업데이트하면할수록 좋아진다 생각하니 계속 가지고 있으면 정말 편해질거같아요~
욱비치,5,2017년 4월 28일,1,"번역기능 (아리아 사과가 일본어로뭐야?) (아리아 사과가 영어로 뭐야?) 세계각국수도명칭 (아리아 미국의 수도가 어디야? , 아리아 캐나다의 수도좀 알려줘) 계산기능(아리아 1+1은? , 아리아 72×6은?) 각지역축제정보(아리아 부천 축제 뭐있어?) 현재 부천은 진달래축제를 하고있습니다. 이쁜꽃들 보러가보세요~ 이런식의 기능들이 추가 되었으면 바란다. 가정에 어린아이가 있는집이라면 이러한 기능은 교육적으로도 누구가 상당한 역할을 해줄것이라 믿는다. 현재 누구의 기능은 상당히 좋으나 기능추가가 신속하며 많은 업데이트가 한번에 추가되...전체 리뷰"
김영경,2,2017년 5월 12일,1,디바이스 연결하기가 안됩니다.대체 어디서 연결해야되는지..좀 짜증스럽네요
아무고토,5,2017년 5월 12일,1,다 좋은데  멜론 음악감상할때나 라디오들을때  자동종료  타임 설정같은거 넣어주세요...  진짜  너무필요해요   제가  못찾는건가요??
love초코냥이,5,2017년 4월 28일,0,너무 좋아요 제가 아리아를 사고 싶었는데 ..근데 비티비는 어떻게 키는건가요?? 그래도 전 이걸 추천할께요
Sungkyu Hong,4,2017년 5월 25일,0,음악재생시 랜덤재생 기능 요청드립니다~ 플레이리스트에 노래가 몇백곡 되는데 맨날 똑같은 노래만 듣는게 답답해요ㅜㅜ  전원도 끌 수 있었으면 좋겠구요~
히힣히히,4,2017년 4월 30일,0,"누구하고 폰을 연결해서 통화기능도 되면 좋을거같고요,멜론노래들을때 검색기능이 없어서 좀 불편해요,번역기능도 넣어주세요"
이윤지,5,2017년 5월 7일,0,오버레이가 감지됐대요 설정에 들어가서 다 해제 시켜도 계속 감지됐대요 화나내요 진짜..ㅡㅡ 이거 어떻게하죠??
김나윤,1,2017년 5월 6일,1,요즘에 말을 못알아들어요 빨간 불만 나오고 ㅡㅡ
화춘이,3,2017년 5월 3일,0,배달  음식이 두종류 라서 아쉬움이남내요                    통화기능도 추가돼어으면 좋게내요                               통화기능  추가돼면 누구 그대로 사용이가능한가요?
박종원,3,2017년 5월 12일,0,오늘 이상해요.와이파이 비번을 알맞게 쳤는데 연결이 안됐다고 나옵니다.
물하별,4,2017년 5월 11일,2,혹시 동화책도 읽어 주나요? 읽어 주면  좋겠어요
김예진,2,2017년 5월 21일,0,연결까지. 다했는데어플리케이션들어가니. 안들머가져요
하늘아래,1,2017년 5월 20일,0,스트리밍이 멜론뿐인게 너무 아쉬워요 다른곳들도 사용할수있으면 좋겠네요 인식도 잘안되고..
Luna m,2,2017년 5월 24일,0,3주 정도 사용후 의견 업데잇트 합니다. 가끔 티비보다가 혼자서 뭐라고 하거나 뭘 키거나 하는 건 그러려니 넘어가는데 블루투스쓸때마다 이거 문제가 심각하네요. 제 폰과 컴터 둘다 해봤는데 폰으로 하면 거의 100프로 블루투스 재생되다가 갑자기 누구와 연결이 끊어졌다고 나오고 연결다시 시키는것도 곤혹이네요. 오늘은 노트북으로 연결시켜서 음악들엇는데 중간에 몇번 소리가 안들려서 다시 껏다켯다를 여러번 반복했는데 나중엔 또 와이파이 연결이 끊어지고 다시 연결시킨다고 얼마나 애먹었는지;;; 연결시키면 또 끊어지고 데이터로 전환되고 아주 생...전체 리뷰
0 happy700,5,2017년 5월 25일,1,사용하기  편하고  좋은데  라디오  방송이 추가   되었으면  좋겠어요 CBS방송  언제쯤   추가 되나요??
이영한,3,2017년 5월 22일,0,누구앱 접속이 안되요 TID일시적 장애 에러코드 1130 이라고 계속 뜨는데 이게뭐죠?
사이다 캬,3,2017년 5월 3일,0,왜14세 미만은 안되나요? 나쁜앱도않인데왜 14세 미만은 않될까요? 이상한거있나요?????
김소연,1,2017년 5월 18일,0,와이파이연결도 제대로 안되고 답답하네요
Google 사용자,5,2017년 5월 6일,1,8개월째 사용중~  정말  심박한 물건입니다~^^♡♡
강준,4,2017년 4월 28일,1,음성인식 치곤괜찬네여
고충영,3,2017년 4월 28일,1,BTV켜지못합니다
김동민,2,2017년 5월 22일,0,음성인식이 잘 안 돼네요
김현영,5,2017년 5월 22일,0,좀더 다양한 기능이 있었으면...
장명운,3,2017년 5월 2일,0,내말을 넘 많이 쌩까네요
모던잘잘,4,2017년 5월 24일,0,집에아리가있으니까뮌가편리 해요!~~^^
권선화,4,2017년 5월 3일,0,조아요~신기해요
Google 사용자,5,2017년 5월 20일,0,이거정말조아요
최영이,1,2017년 5월 15일,0,안좋음
박주희,3,2017년 5월 19일,0,좋아용
종열류,5,2017년 4월 28일,1,좋아요
Google 사용자,5,2017년 5월 4일,0,정말 잘 안드셨네용~~~~~~^^♡♡♡♡♡♡♡♡♡♡♡♡♡♡♡♡♡♡♡♡♡♡♡♡
현주희,1,2017년 4월 25일,3,제대로 만든거 맞나요? 두대나 쓰고있는데 갑자기 먹통된이유는 뭐냐구요 그렇다고 접속도안되고 누구앱이랑 연결도 안되고 기기삭제후 재연결하려니 하나도 안되고 장난해요? 아예 누구 초기화에 대한것도 안나오고 페어링 대기상태도 어떻게 해야하는지 설명서에도 없고 뭔 이런 쓰레기가 다있는지 모르겠네요
Jeong Up Park,2,2017년 4월 27일,2,지니처럼 통화기능이 없다니 말도안되 ㅡㅡ
Je L,1,2017년 4월 27일,0,아진짜. 사서 써보지도못하고 계속 먹통이잖아요!!! 이거환불안되나요. 한두푼도 아니고 진짜짜증나죽겠네.
김철준,3,2017년 4월 27일,0,잘쓰다가 디바이스연결 못함 와이파이는 문제없음. 앱과 기기문제인듯.
은은,2,2017년 4월 26일,2,왜 계속 스마트폰과의 연결이 안된다고 하죠?
이현규,5,2017년 4월 29일,0,잘 쓰고 있어요~
John Craft Junior,3,2017년 4월 25일,6,업데이트만 하면 와이파이 오류가 납니다. 앱은잘실행되는데요. 업데이트하면 와이파이를 잘 못잡습니다 그래서 안쓰기로 했어요.그리고 정말 짜증나요
Jang Jin,4,2017년 4월 22일,3,업데이트 이후로 네트워크 지연 문제 생겼어요; 얼른 수정해주세요. 어째 업데이트하면 할수록 버그가 많아지는 느낌...
허태범,1,2017년 4월 24일,0,아니 왜 업데이트하고 나니까 안되나요 멜론만 안되네요. 다른 건 다 잘되는데 멜론은 네트워크지연이라면서 안되고 어쩌다 되면 한 곡 나오면 멈추고 누구어플로 멜론 실행시켜도 재생이 안되고 이게 뭐지요. 업데이트에 문제 있는거 아닌가요 저만 그런게 아닌거 같은데 왜 갑자기 무슨 주파수 얘기가 나오고. 전엔 잘되던게.... 솔직히 이거 멜론 노래들으려고 쓰는건데 쓸모가 없어졌어요
Mun Hyun Jang,1,2017년 4월 22일,2,ㅡㅡnugu하루만에  안됩니다 nugu앱에서 갑자기 연결디바이스를  찾지못하며  nugu는 인터넷 연결을하라고하는데 제가it관련일을하고있습니다 이거 지금 nugu기기디바이스 오류인거같은데 처리좀하시죠
정주박,5,2017년 4월 21일,2,업데이트 이후 인터넷 연결할수 없다고하네요. Wifi led에 불도 안들어오고 초기 연결세팅 진행이 안되네요 디바이스가 목록에 안나옴. 저만 그런긋 ㅜ
