,index,nugu,score
257,258,9월29일에 받아 아직까지 디바이스 연결이 안되네요. 뭐가 문제인지 모르겠네요. 공휴일이라 전화도 안되고. 별하나도 아깝네요.!,1
258,259,"일단 인공지능은 좀 아닌거같고 음성인식 블루투스 스피커라 생각하면 편함 지금은,99000이면 스피커로써 괜찮아요 그리고 배송 진짜 ,,,ㅜㅜ",4
259,260,최악~~~ 말도 못알아 들어서 소리 질러야 하고 음악도 제목을 얘기해야 하는데 다른음악 틀어주는건 다반사고 정말 막급 후회~~~ 인공지능이라 아마존거 생각만 했느데 그건 정말 잘 알아 듣던데... 후진 발음이라도.... 절대 구매하지 마세요 이가격대 좋은 블루투스 스피커 구입하세요,3
260,261,음성인식 생각보다 좋음. 말로 하는게 불편할 줄 알았는데 써보니 굉장히 편함. 처가 및 친가에 선물 보냈고 존경하는 선배님 드리려고 또 샀음. 강추함,5
261,262,지정된 호출어만 사용하니 좀 아쉽네요. 그리고 블루투스 연결하여 음악감상시 호출명령어를 잘인식못합니다. 암튼 재밌는 기기이긴합니다.,4
262,263,11일부터 출고라고 했던것 같은데 언제온다 소리도 없이 어느순간 왔더라구요? 인식률은 80프로정도?? 알아듣는거는 생각보다는 좋아요.,3
263,264,음성 인식을 시키려면 소리를 높여야 해서 목이 좀 아프지만 3살 아이에게 동요도 들려주고동화책을쉽게 읽어줄 수 있어요아주 만족합니다. 인터넷 검색 기능이나 위키피디아 등을 읽어주는 기능이 빨리 추가되었으면 좋겠습니다.,2
264,265,아직은 어린아이 수준이지만 앞으로가 기대되네요. 아마존 에코처럼 지속적인 업데이트가 이루어졌으면 좋겠네요.,1
265,266,음성인식도 잘되고 음악듣기에는 정말 좋아요.다만 이름을 부르지 않았는데도 혼자서 간혹 인식을 해서 대답을 하는 점이  살짝 불편하네요.,5
266,267,다 좋은데 최대한 가까이 다가가 말을해야 알아 먹는게 개선해야겠네요 재밌게 잘 사용하고있습니다,5
267,268,필요하다기 보단 궁금해서 사봤는데 저보다 애들이 더 잘쓰네요 집에오는 손님들도 신기해하고 날씨랑 음악듣기만 해도 본전뽑아요 ㅎ,4
268,269,아직 호환기능은 다양하지 않지만 블루투스 스피커 기능에 다양한 음성인식까지 예판가 수준이면 구매할만하네요,5
269,270,예약 주문해서 싸게 샀네요. 뭐 이 정도면 초기 제품치고는 괜찮아요. 음질도 좋고 반응도 100프로 만족은 아니지만 용납 가능할 정도에요.,5
270,271,"완전별로입니다..
인공지능이라고는 음악트는것뿐..스피커있는데, 괜히산기분..다른기기들이랑 블루투스로라도 연결되거나..말이라도 여러가지 할줄알면 좋으련만.. 기능이없어요..아깝..",5
271,272,남편 선물로 샀어요ㅡ 아직 연결하지는 않았지만 좋네요ㅡㅋ,4
272,273,판매처에서 디바이스 설정이 늦게돼서 페어링 시키느라고 스트레스 받았은데 서버에 입력하고나서 그런데로 잘 사용하고 있습니다,3
273,274,안드로이드 7.0 에서는 아직 호환되지 않는 듯. 와이파이 연결이 안되어 다른 폰으로 해봤더니 잘됨. AI는 아직 걸음마 수준이지만 이용하기에 재미납니다. 좀 무거운 편. ^^,2
274,275,"첨단의 기기에 익숙해 지려고 구입하였읍니다. 알려져있는 성능 그대로 잘 작동하고, 지속적인 업데이트가 자주 일어났으면 좋겠네요",1
275,276,"안좋은 후기도 많아 걱정했는데...
전 만족합니다! 못찾는 노래(가요는 물론 동요 자장가 클래식 장르구분없이 잘 찾아요)가 없네요 
7살 큰애도 제법 잘 사용하구요",1
276,277,작년에 사서 아직도 계속 사용중입니다 멜론을 자주 이용하기에 이 상품이 더 편하고 앞으로도 계속 발전하는 상품이기에 기대가 큽니다,5
277,278,배송은 빠르게 왓고 포장도 튼튼하게 잘되어 있습니다. 누구써보니 기능이 어렵거나 힘들지 않더군요. 설정다하고 여러기능써보니 재미있내요. siri보다 더 나아질수도 있겟내요. 만족합니다.,4
278,279,"아직 음성 인식이 서툴긴 하다. 하지만 음악 감상, 알람, 날씨, 뉴스 등 영역에서 실용성을 보인다. 조금 더 게을러질 수 있을 것 같다.",3
279,280,스피커는 지금 쓰고있는 hi-res 보단 못하지만 고급 스피커와 견줘도 그렇게 많이 차이나지않음 인공지능 기능은 앞으로가 기대됨!,5
280,281,아이폰 시리나 갤럭시의 S보이스.. 다 똑같은 답답이들^^; 단지 구글 스캐줄 확인을 음성으로 듣기를 원했고 음악은 덤~ 나중에 더 똑똑해지면 그땐 감사!,5
281,282,2주전에 샀는데 마음에 들어서 노친네 쓰시라고 드리고 새로 샀습니다.그런데 가끔 wakeup command에 반응안할 때가 있어서 재부팅을 해야하는 경우가 가끔 있네요  전과 달리,4
282,283,일단 기본적인 블루투스 부터 문제가 많네요..소리 싱크가 이렇게나 안 맞아서야 원...지금으로선 그냥 노래 듣는 용도로 밖에 쓸데가 없네요,3
283,284,6학년꼬맹이 죙일 아리아아리아 불러대는통에 확~~~~ 이름을 바꿔버릴까 싶네요ㅠ 음성인식도 잘되는듯하나 아직까지 영어같은건 또박또박 한국발음으로 하면 알아듣더라고요ㅡㅡ 외관도 심플하고 작아서 공간차지안하고 집에있는 스탠드보다 훨씬 뽀대나네요.,2
284,285,직접 가서 누를 필요없이 말로두 작동시킬수 있다니 편하긴 하네요 다만 앞으로 다양한 기능이 많이 추가됐으면 하는 바람입니다,1
285,286,"배송이 많이 늦긴 했지만 예약판매라 목빼고 기다린 보람이!
멜론 음악 완전 잘 틀어주고 날씨 시간도 잘 알려 주고
앞으로도 더 좋은 기능 넣어 주세요",5
286,287,신기할거 같아서 구입해 봤구요..  실활용도는 아직 많이 떨어지고 음성인식도 되는것만 잘 되고 펌워어등 앞으로 발전을 계속 해야겠네요...,4
287,288,아직 작동하는데 미숙한 부분이 많지만..신기하고 기분좋게 하는 뭔가가 잇네요~^^ 전체적으로 사운드도 괜찮구 안내 목소리도 상큼하이 좋아요~^^,2
288,289,솔직히 크게 기대는 안하고 샀는데 신기하고 괜찬네요 지금도 노래 틀어달라고해서 듣고있네요,5
289,290,이거 대박 전처음에서 사서 싸게 샀는데 완전 좋음 하나더살까 고민중입니다 중고로 파실분있으시면 말씀하세요 제가 살게요,4
290,291,"포장상태 좋았고, 배송도 빨랐습니다. 크기도 적당하고 애들과 노래도 듣고...애들이 특히 좋아합니다.",5
291,292,생각보다 음성 인식률이 좋구 앞으로 더 기대가 되는 제품입니다. 계속 사용자와 소통하고 보다 혁신적인 업데이트 부탁드립니다.,4
292,293,음질 좋고. 깔끔하네요. 라디오도 되고 해서.. 좋아요. 공룡스티커는 아이들이 넘 이뻐하는데.. 2개면 더 좋았을 거 같네요,3
293,294,"말 그대로 효도 선물로 좋아요~ 다만, 인공지능 스피커가 아직은 기술적으로 초기 단계여서인지 음성 인식 상에 인지 차이가 꽤 있네요~",2
294,295,"서버에 시리얼이 등록되지 않아, 음성명령을 사용하지 못하고 있음. 공지사항에 운영팀에서 서버로 해줄 수 있다함에 구매확정함",1
295,296,"나쁘지않지만 요류가 많이있네요 제가 이전에 들은노래를
지금듣고있는노래에서 무슨노래야 하고물으면 이전곡
이름을 말하네요",5
296,297,편리하긴 한데 옆에서 떠드는 말에도 인식을 해서 알아듣지못했다고 말합니다. 누구 어플에서도 멜론 노래 검색할수 있으면 좋겠네요,5
297,298,"지금은 값비싼 알람,  멜론 재생기, 날씨 확인 역할 뿐입니다. 갈길이 멀지만 미래가 기대되는 제품이기에 후회없이 구매하였습니다.",5
298,299,음성인식은 타사  음성인식기능 정도이긴한데 블투스피커라는점과 멜론연동입니다,4
299,300,사자마자 업데이트 해서 겁나 기능이 많아졌어요 그래서 기분이 좋아요 앞으로 업데이트를 기다리며 기대를 더해 봅니다,4
300,301,생각했던 그대로 매우만족합니다 저는 스마트홈연결해서 사용하니 아리아불좀꺼줘 같은 명령실행도 빠르고 좋네요,5
301,302,쓰면 쓸수록 음성인식 떨어지는 부분들이 발견되지만 곧 업데이트 될거 같아요~~ 집오면 다들 아리 찾고 너무 재밌게 쓰고있어요 :) 만족~~,4
302,303,10시간 만에 주인 퇴근해서 집에 왔으면...먼저 인사좀 하자....아리야ㅋ 아직 까진 별다른 기능이 없네요....무드등으로서의 기능은 좋은듯 하네요 뉴스 읽어 주는 기능만 추가 되면 좋겠네요....잠들기전에...각종 뉴스 듣다보면 잠이 잘올듯,3
303,304,"아직은 그냥 그런수준

유투브에서 누가 했던 리뷰처럼 농담도 안먹히고..

점차 성능 개선해나갈거라 믿고 구매확정합니다",2
304,305,인식도 잘 안되고 기능이 별로 없어서 아직은 무드등과 스피커로만 사용할듯 하네요. 기능이 다양해졌으면 하네요. 많은 발전을 기대할게요.,1
305,306,이름 부르면 반응해서 너무 신기했어요 ㅎ 집에서 대화하고 있을 때 질문형이나오면 질문으로 인식하는 것도 신기해요,5
306,307,"안까봤어요 어머니 선물로 줄거라 아직 안깟는데 
10월 특별가로 싼맛에 샀습니다. 가격도 점점 올린다길레 팔랑귀라",5
307,308,"어쩜 이리도 신기한게 있을정도로 너무 좋네여.. 매일 아침마다 분위기 있게 틀어놓고 시작하는 기분 최고입니다. 매일 이것저것 질문하는데, 쫌 웃겨여... 점점 업데이트가 되서 기대됩니다.",3
308,309,아직은 더 발전 해야할것같아요 단점들이 좀 많아요 ㅎㅎㅎ 뭐 아직은 개발중이니까 .. 큰소리치면 저절로 자길 불렀냐는 듯이 깨어납니다~ 그리곤 죄송하지만 찾지못했다고 그러지요~~ 또 못알아듣는 말이 더 많네요...^^;; 그래도 재미는있어요 . 몇가지 밖에 할순없지만 ... 앞으로 더 많이 발전하길 원하며~,2
309,310,"말귀를 못 알아먹는 아리, 추후 업데이트로 똑똑해지길 바랍니다. 하지만 멜론과의 연동과 일정 관리 하나는 만족스럽습니다.",2
310,311,관심이 있어서 알아보고 있었는데 마침 11번가 딜이 올라와서 바로구메했어요 지금 사용해 보는라고 정신없어어요,5
311,312,"배송 받아 바로 작동시켜봤는데 음성인식이 어느 정도 잘 되네요. 음악 듣기, 알람 설정, 일정 확인 등을 음성으로 할 수 있어 편리하네요.",4
312,313,"음성인식이 아직까지는 좀 버벅거립니다. 천천히 발음하면 잘알아듣고요. 저희 집에서는 아이가 제일 잘 씁니다. 동요 틀어달라고. 그리고, 제가 잘 쓰죠. 쉬는날 라디오 청취로. 자칭 얼리어뎁터로서 잘 쓰고 있습니다.",3
313,314,"가격대비 음량도 풍부하고  무엇보다 음질이 짱이네요.
멜론의 풍부한 콘텐츠와 잘어울리는  좋은비서 한명 모셔왔네요",2
314,315,"싸게샀구요 빠르게 왔네요. 음성 인식할때 wifi 연결하라는 말이 어려울건데, 와이파이 뜨는거 검색해보면 누구 디바이스 있습니다.",1
315,316,아직 미흡한점이 있으나 개선될 점이 많은 것에 기대가 큽니다... 현재는 블루투스 스피커와 크게 다른게 없습니다.. 발전 기대하겠습니다...,4
316,317,"재미있는 기계인 것은 분명합니다. 인식률이 아주 높지는 않고, 나눌수 있는 말도 그다지 많지 않으나...업그레이드를 기대해봅니다.",4
317,318,상품은 맘에 들지만 아무리 순차배송이라고 해도 배송 속도나 언제쯤 출발한다는 그런 정보가 너무 부족하네요,5
318,319,택배 잘 도착해서 잘 받았습니다. 인터넷으로 주문하다보니 발품팔지 않고 물건을 착한 가격에살수있어서 좋습니다,5
319,320,선물용이라 아직 시험해보지 않았지만 가방도 사은품으로 오고 좋네요.,5
320,321,정말 좋아요 집에서 사용중인데 너무 좋아서 친구 헤어샵 오픈선물로 구매해서 보내 줬더니 너무 좋아라 합니다. 활용도 좋고 음질도 괜찮고 너무 좋아용,5
321,322,다시 받은 누구 이번에는 아는 지인에게 선물하였는데 맘에 든다고 재미있다고 하는데 더 써봐야 알겠다고 하네요,4
322,323,음성인식 기술과 인공지능 엔진을 통해 원하는 명령을 수행하는 서비스 나날이 업데이트 되기를,3
323,324,사은품도 잘 왔고~~~ 누구 테스트 결과 너무나 반응을 잘해줍니다^^ 듣고싶은 노래 찾을 필요 없이 바로바로 음성으로 말하면 바로 재생해주고 앞으로의 서비스가 기대됩니다^^,2
324,325,초기 디바이스 인식 문제가 있었지만 해결되어 잘쓰고 있습니다. 추후에 이루어질 많은 기능들 기대하고 있겠습니다.,1
325,326,배송은 느리다고 하서 감안하고 기다렸습니다. 써본결과 나쁘지는 않습니다. 다만 제가격주고는 못살꺼 같습니다. 많이 업그레이드 되었으면 해서.. 말귀를 가끔 못알아들어서 엉뚱한소리를 하기는 하는데...나름 쓸만 합니다.,4
326,327,정해진 음성 방법만 잘 따르면 괜찮은거같습니다. 일반 블루투스 스피커가격에 음성인식까지 너무 마음에 듭니다.,4
327,328,아리아~! 만족해요 가족들에게 새로운 재미가 생겼네요 무드등도 은은해서 분위기를 up시켜주네요 멜론 3개월권도 나쁘네요,5
328,329,선물로 샀는데 배송도 생각보다 많이 기다리지 않앗고 잘 작동됩니다. 잘쓸게요,5
329,330,"구매평보고 걱정 쓰러웠는데 정말 괜찮은거 같네요
음성인식두 잘되구  음악소리도 큼직만한게 딱 좋아요",3
330,331,"계속 진화하는 누구를 응원합니다 신혼부부 선물, 이사하는 주위분들 선물로 강추합니다",5
331,332,신랑이 넘 사고 싶어해서 주문 했는데 생각보다 그냥그냥 그래요 활용이 잘 안되서 아쉽네요 ㅜㅜ,4
332,333,ㅎㅎ.. 초기 할인특가에 정말 잘 샀어요.. 누구의 음성인식도 맘에 들고 대화하는 재미가 솔솔.. 완전 맘에 듭니다.. 앞으로 더 업그레이드 된다니 기대가 됩니다..,3
333,334,초기라서 그런지 약간 스마트하지 못한것같고  이름이 4개뿐이라서 별로이다 단어가 한정적이다 지식도 한정적이다  단지 음악듣기용정도...,2
334,335,괜찮네요. 다만 와이파이가 tv옆에 있어서 tv소리 겹치지 않으려고 누구가 떨어져있어 간혹 와이파이를 못잡는게 아쉽네여.,1
335,336,아리아 시키는 대로 너무 잘 들어 줘요 너무 이쁜아이 맞아요 세상이 참 좋은세상이라는 거 우리 모두 즐겨요,5
336,337,"첨엔 디바이스랑 연결이 잘 안 되서 조금 헤메기는 했지만, 멜론 이용권과 치킨 or 피자 쿠폰도 같이 받아서 좋고, 음질도 좋습니다~ ^^",4
337,338,현재는 음성으로 명령해서 음악듣는 것이 다 인것 같아요..그런데 음성인식이 잘 안될때도 있어요..그럼 전원으로 리셋을 시키지만...여하튼 인식관련해서 인식률이 더 좋아졌으면 하네요...또 응용소프트가 더 많아졌으면해요...한달에 1-2개씩은 업데이트 되야 하지 않을까 하네요...이 기기가 실패로 끝나지 않기를 바라며...,5
338,339,상품은 잘 받았고 포장 상태 양호 사은품도 받고 그런데 피자 쿠폰 등록이 안되어서 짜증나네요 음성 인식은 보통 정확히 말해야 합니다 Btv연동 서비스는 잘되는데 처음 설정할때 엄청 귀찮음,3
339,340,"배송도 괜찮고, 제품도 좋아요. 주말에 주문했는데 대략도착 시간이 사전 안내되면 좋겠네요. 어쨋든 잘 받았습니다.",4
340,341,아직 초기단계라 더많은 발전을 필요함 핸드폰 음성인식을 밖으로 뺀 기능정도,5
341,342,급해서 퀵으로 받았습니다. 퀵비 4만원...ㅜ.ㅜ 그래도 딸이 간절히 원해서 크리스마스 선물로 사촌언니꺼 까지 두개 구입 완료!!,4
342,343,아이가 너무 좋아합니다. 휴대폰과 한번만 접속해주면 그뒤부터는 사용하기편하고 스피커소리가 좋습니다,3
343,344,조카 졸업 선물로 샀는데 가격도 저렴한 편이고 멜론 이용권 도 들어 있어서 좋네요,2
344,345,상품도착하자마자 무료배송 이벤트가 되다니 좀 너무하시네요 암튼 제품은 잘 쓰겠습니다,1
345,346,잘 받았습니다. 상품은 아담하고 이쁘네요... 음악 듣기에는 정말 좋아요 일일이 찾을 필요없이 누구에게 말만하면 알아서 찾아 들려주니 편하네요.. 생활언어는 아직 미흡한데 차차 똑똑하게 된다고 하니 기다려 봐야죠...,5
346,347,제품은 만족합니다. 기능도 잘되고 ...아직은 좀더 사용해봐야겠지만  잠깐 사용해본 느낌은 좋네요..인식도 잘되고 소리도 좋고...묵직한 안정감 있습니다.,5
347,348,내가 써보고 아이 있는 집에서 좋을꺼 같아~ 선물했네여! 예전에 특가했다던데~ 그부분이 아쉽!!,5
348,349,주문 후 하루만에 잘 받았습니다 현재는 인공지능이 아니지만 앞으로 학습되어 발전하길 기대합니다,5
349,350,할머니에게 선물해드리니 아주좋아하세요. 그러나 인식이 잘안되는것같네요. 가까이서 얘기하면되니깐 상관없긴해요,3
350,351,"99000원때 사서 다행이고 기능추가보다
기존에 있는 것들을 더 편리하게 만드는게 우선인듯",5
351,352,똑똑하고 아직은 완벽하지 않지만 진화 하고 계속 발전한다고 해서 구입했어요 처음에 구입시는 아기 상태라고 생각하면 하나의 아기를 키운다고 생각하면 될것같아요 !!,4
352,353,먼저 한개 구입하고 친구 선물 주려고 2개 더 구입했는데 배송이 너무 느려 완전 실망입니다. 재고가 없었는지 주문하고 열흘도 더 넘게 기다렸던거 같네요. 생일선물 이었는데 시간이 지나서 선물하게 되어 찝찝했습니다.,3
353,354,지난번 구입한 1대와 오늘 배송된 2대가 왔네요. 재미있게 사용하면서 Smart Home 생활을 해봐야 겠어요.,2
354,355,기술적으로는 아직 발전이 많이 필요하지만 무엇보다 이쁘네요. 우리나라 인공지능의 발전을 기원합니다.,1
355,356,상품은 정말 마음에 드는데 택배기사님이 상품을 그냥 집앞에 던져두고 가네요 집에 사람있는데도요....,3
356,357,요즘 핫하다는 NUGU 5대 사서 주변에 연말 선물 돌렸어요. 반응이 아주 좋네요 ㅋㅋ 앞으로 계속 업그레이드 잘해주시길!,5
357,358,정말 마음에 듭니다!! 음성으로 제어하는게 너무 매력적이에요. 이거 쓰다보니 길거리에서도 찾게 될정도랄까...ㅋ 사용자 의견을 적극 반영하겠다는 업데이트 계획도 마음에 쏙 드네요~ 빨리 누구가 성장했으면 좋겠습니다~^^,3
358,359,아직은 음성인식률이 떨어집니다.점점 업그레이드되면 누구를 사용하는게 즐거워지지않을까싶네요 잘쓰겠습니다~~,5
359,360,"와~!!! 생각보다 음성인식이 잘 되네요.
겔노트는 음성인식 별로라서 큰 기대 안했는데.
인터넷 검색까지 해주면 더 좋을듯.",5
360,361,"스피커 만으로도 훌륭한 가격입니다.
신기한 물건이긴 하지만 아직은 더 배워야겠네요 ㅎㅎ NUGU의 진화가 기대됩니다.",5
361,362,사지 마세요.. 자기 이름(아리아) 5~6번 불러야 반응 합니다. 노~~굿입니다. 목아파 죽는줄 알았네요. 저는 별로 마음에 안들어요.,4
362,363,스피커와 무드등 값어치만 해도 가격 뽑고 남습니다. 앞으로 더 좋아진다고 하니 아주 좋은 물건 같네요,3
363,364,아주 재미있어요 신기하고 좋아요 음성을 알아듣고 노래를 틀어주고 날씨를 알려주고 알람을 알려주고 일정을 알려주고 정말 신기하네요 앞으로 더 진화한다니까 기대되고 앞으로 더발전된 누구를 만나고 싶네요,2
364,365,"아직까지는 안되는게 더 많고 되는건 별루 없네요, 대신 업데이트를 기대해 4별 드립니다.더 빠르게 발전하길 ..",1
365,366,음성인식 잘되고 음질 깨끗하고 너무 좋아요. 다만 가끔씩 이름을 부르지 않았는데 인식하고 대답을 함.ㅋ,5
366,367,아직까지 음성인식이 잘 안되네요. 지정된 형식의 명령만 수행하고 그냥 음악듣기에만 좋은듯 합니다.,1
367,368,넘넘 좋고 점점 똑똑해지니 좋네요 ㅎㅎ 강추합니다!! 그러긴한데 음성인식정확도와 멜론연동이 꼭 필요한건 빼고는 괜찮네요 유튜브같은것도 연동 ？瑛만？ 좋겠고 팟캐스트검색기능도 얼른말해주세요!!,5
368,369,인공지능 스피커 처음 써보는데 정말 기대 이상이네요 신기하기도하고 ㅎㅎ 잘쓰겠습니다~ p.s 스벅쿠폰 보내주세용~~,5
369,370,발송할때부터 그런건지 오래동안 이랬었는지 모르겠지만 설명서도 그렇고 보관 상태가 안좋네요.,4
370,371,받자마자 사용했는데  맘에 드네요. 좀더 많은기능이 추가되면 좋겠습니다. 그래도  음악듣기는  짱 입니다~,5
371,372,그냥 인간 음성이 나오는 블루투스 스피커. 음성명령도 도스시절 프롬프트 명령어 때려넣는 식. 다만 스피커 음질은 괜춘은 편,4
372,373,"광고에 나오는 기능만 되는 걸 알고 구매했지만... 아직 할 수 있는 게 정말 없네요
그래도 앞으로 추가될 기능을 기대하며...",3
373,374,사실 노래랑 날씨말곤 아직 미흡한게 사실입니다만 업데이트되겠지요,2
374,375,"정말 좋은 제품입니다. 음성인식율은 현재 제공되는 서비스 문장의 경우 거의 95%이상 정확도가 있으며, 앞으로 계속적인 음성인식 서비스의 다양화와 관련된 업그레이드 해 주시길 바랍니다.",1
375,376,아이들이 좋아하니 그걸로 충분한듯 합니다 저도 라디오와 알람 블투 스피커 잘 쓰고 있습니다,5
376,377,정확한 발음과 규칙만 잘 따른다면 불편없음. 인공지능보단 음성명령 실행기기 정도. 업데이트를 기다림.,2
377,378,아직 사용을 안해봐서 모르겠지만 상품 자체는 고급스러워 보이고 무게도 묵직하니 좋아 보이고 디자인도 맘에 듭니다.,4
378,379,"음악듣기, 날씨, 시간 등 기능이 너무 제한적이네요. 2차 개선 제품을 구매하는 걸 고려해보는 게 좋을 듯하네요.",4
379,380,"요즘 광고나 티비에서 뜨는 상품이라 구매했는데, 크리스마스 선물도 함께 줘서 더 좋은것 같습니다.",5
380,381,아직까지는 미흡하고 말로 시키는 스피커 사셨다고 보는게 좋을꺼같아요 점차 나아질꺼같네요. 마이크나 소리크기도 괜찬고 음질 자체도 괜찬아서 자주쓰기만하면 돈아깝지는 않을듯,5
381,382,편하고 심심할때 친구 같아요. 듣고 싶은 음악을 항상 말로해서 들을수 있다는것도 매력적이네요,4
382,383,추천으로 구입했는데.. 생각보다 기술이 많이발전했네요.. 좋아요...,3
383,384,완전 좋습니다. 아이들 아침에 알람으로 노래틀어서 깨워주는것도 좋고 노래 듣는것도 좋습니다. 아직은 조금 기능면에서 부족한것들이 보이지만 앞으로 더 발전하면 다양한 분야로 확장될듯 합니다.,2
384,385,싸게 잘 싼거 같아요 플러그도 잘 되고요 단지 만든 날짜가 작년 꺼란거 빼곤 좋습니다 생활이 편해 졌네요,1
385,386,지인소개로삿어요 신세계네요 인식이 좀 느리고 멜론밖에안되서 아쉽지만 쓸만해요,4
386,387,뭔가 음성인식이 좀 잘 안되거나 잘못 알아듣는 경우가 많아요 이런거 업뎃좀 잘하면 좋을턴데,5
387,388,아직은 미흡 하지만 나름 써볼만 하다는 생각이 드네요. 앞으로 더 발전된 누구가 되겠지요. 잘 쓸께요,4
388,389,아직 멀었네요. 잘 알아들었다말았다하고 말하다가 뚝 끊기기도하네요 많은 업데이트가 필요합니다,5
389,390,처음에 연결이 안되서 고생했는데 한번 잡히니깐 잘 되네요. 혼자 업그레이드도 하고 ㅎㅎ 아침에 출근하면서 날씨랑 일정확인했어요 ㅋㅋ 오늘 멜론도 연동했으니 음악 좀 들어야겠네요. 정말 신기합니다,5
390,391,스피커와 무드등의 사용만으로도 가격 뽑고 남네요.더욱더 좋아진다고 하니 횡재가 아닐 수 없네요.^^ 좋아요,5
391,392,음질도 생각보다 훌륭하고 음성인식 잘 알아듣네요. 굉장히 유용합니다. 더 쩌는 업뎃 기대해 봅니다,4
